"id","conference","title","work_type","url","parent_session"
"6323","20","The Idea of a University in a Digital Age: Digital Humanities as a Bridge to the Future University","10","",""
"6324","20","Handwritten Text Recognition, Keyword Indexing, and Plain Text Search in Medieval Manuscripts","10","",""
"6325","20","Organising the Unknown: A Concept for the Sign Classification of not yet (fully) Deciphered Writing Systems Exemplified by a Digital Sign Catalogue for Maya Hieroglyphs","10","",""
"6326","20","LitViz: Visualizing Literary Data by Means of text2voronoi","10","",""
"6327","20","Burrows’ Zeta: Exploring and Evaluating Variants and Parameters","10","",""
"6328","20","Searching for Concepts in Large Text Corpora: The Case of Principles in the Enlightenment","10","",""
"6329","20","Computational Analysis and Visual Stylometry of Comics using Convolutional Neural Networks","10","",""
"6330","20","Visualizing the Feminist Controversy in England, 1788-1810","10","",""
"6331","20","Women’s Books versus Books by Women","10","",""
"6332","20","SciFiQ and “Twinkle, Twinkle”: A Computational Approach to Creating “the Perfect Science Fiction Story”","10","",""
"6333","20","Challenges in Enabling Mixed Media Scholarly Research with Multi-media Data in a Sustainable Infrastructure","10","",""
"6334","20","Digital Modelling of Knowledge Innovations In Sacrobosco's Sphere: A Practical Application Of CIDOC-CRM And Linked Open Data With CorpusTracer","10","",""
"6335","20","Design on View: Imagining Culture as a Digital Outcome","2","",""
"6336","20","Cataloging History: Revisualizing the 1853 New York Crystal Palace","2","",""
"6337","20","Complex Networks of Desire: Mapping Community in Visual Arts Magazines Fireweed, Fuse, and Border/Lines","2","",""
"6338","20","Digital Storytelling: Engaging Our Community and The Humanities","2","",""
"6339","20","Research Environment for Ancient Documents (READ)","2","",""
"6340","20","Question, Create, Reflect: A Holistic and Critical Approach to Teaching Digital Humanities","2","",""
"6341","20","Using Zenodo as a Discovery and Publishing Platform","2","",""
"6342","20","Using Topic Modelling to Explore Authors’ Research Fields in a Corpus of Historical Scientific English","2","",""
"6343","20","A Style Comparative Study of Japanese Pictorial Manuscripts by “Cut, Paste and Share” on IIIF Curation Viewer","2","",""
"6344","20","Rules against the Machine: Building Bridges from Text to Metadata","2","",""
"6345","20","""Moon:"" A Spatial Analysis of the Gumar Corpus of Gulf Arabic Internet Fiction","2","",""
"6346","20","Building a Community Driven Corpus of Historical Newspapers","2","",""
"6347","20","Hispanic 18th Connect: una nueva plataforma para la investigación digital en español","2","",""
"6348","20","Reimagining Elizabeth Palmer Peabody’s Lost “Mural Charts”","2","",""
"6349","20","The Archive as Collaborative Learning Space","2","",""
"6350","20","Text Mining Methods to Solve Organic Chemistry Problems, or Topic Modeling Applied to Chemical Molecules","2","",""
"6351","20","Visualizando Dados Bibliográficos: o Uso do VOSviewer como Ferramenta de Análise Bibliométrica de Palavras-Chave na Produção das Humanidades Digitais","2","",""
"6352","20","Stranger Genres: Computationally Classifying Reprinted Nineteenth Century Newspaper Texts","2","",""
"6353","20","La Aptitud para Encontrar Patrones y la Producción de Cine Suave (Soft Cinema)","2","",""
"6354","20","Unsustainable Digital Cultural Collections","2","",""
"6355","20","Decolonialism and Formal Ontology: Self-critical Conceptual Modelling Practice","2","",""
"6356","20","Expanding Communities of Practice: The Digital Humanities Research Institute Model","2","",""
"6357","20","Encoding the Oldest Western Music","2","",""
"6358","20","Digital Humanities Storytelling Heritage Lab","2","",""
"6359","20","HuViz: From _Orlando_ to CWRC… And Beyond!","2","",""
"6360","20","Style Revolution: Journal des Dames et des Modes","2","",""
"6361","20","Making DH-Course Together","2","",""
"6362","20","Atlas de la narrativa mexicana del siglo XX y la representación visualizada de México en su literatura. Avance de proyecto","2","",""
"6363","20","Building Bridges Across Heritage Silos","2","",""
"6364","20","Prosopografía de la Revolución Mexicana: Actualización de la Obra de Françoise Xavier Guerra","2","",""
"6365","20","Digital Humanities Under Your Fingertips: Tone Perfect as a Pedagogical Tool in Mandarin Chinese Second Language Studies and an Adaptable","2","",""
"6366","20","Digital 3D modelling in the humanities","2","",""
"6367","20","Combining String Matching and Cost Minimization Algorithms for Automatically Geocoding Tabular Itineraries","2","",""
"6368","20","Resolving South Asian Orthographic Indeterminacy In Colonial-Era Archives","2","",""
"6369","20","""Smog poem"". Example of data dramatization","2","",""
"6370","20","Bridging the Gap: Digital Humanities and the Arabic-Islamic Corpus","2","",""
"6371","20","A New Methodology for Error Detection and Data Completion in a Large Historical Catalogue Based on an Event Ontology and Network Analysis","2","",""
"6372","20","‘This, reader, is no fiction’: Examining the Rhetorical Uses of Direct Address Across the Nineteenth- and Twentieth-Century Novel","2","",""
"6373","20","El primer aliento. La expedición de los lingüistas Swadesh y Rendón en las ciencias computacionales (1956-1970)","2","",""
"6374","20","Herramienta Web Para La Identificación De La Técnica De Manufactura En Fotografías Históricas","2","",""
"6375","20","Codicological Study of pre High Tang Documents from Dunhuang : An Approach using Scientific Analysis Data","2","",""
"6376","20","Manifold Scholarship: Hybrid Publishing in a Print/Digital Era","2","",""
"6377","20","SSK by example. Make your Arts and Humanities research go standard","2","",""
"6378","20","How We Became Digital? Recent History of Digital Humanities in Poland","2","",""
"6379","20","Intellectual History and Computing: Modeling and Simulating the World of the Korean Yangban","2","",""
"6380","20","Digitizing Whiteness: Systemic Inequality in Community Digital Archives","2","",""
"6381","20","Introducing Polo: Exploring Topic Models as Database and Hypertext","2","",""
"6382","20","The Spatial Humanities Kit","2","",""
"6383","20","The Two Moby Dicks: The Split Signatures of Melville's Novel","2","",""
"6384","20","The Magnifying Glass and the Kaleidoscope. Analysing Scale in Digital History and Historiography","2","",""
"6385","20","Studying Performing Arts Across Borders: Towards a European Performing Arts Dataverse (EPAD)","2","",""
"6386","20","Ethical Constraints in Digital Humanities and Computational Social Science","2","",""
"6387","20","Modeling the Genealogy of Imagetexts: Studying Images and Texts in Conjunction using Computational Methods","2","",""
"6388","20","Educational Bridges: Understanding Conservation Dynamics in the Amazon through The Calha Norte Portal","2","",""
"6389","20","Building a Bridge to Next Generation DH Services in Libraries with a Campus Needs Assessment","2","",""
"6390","20","World of the Khwe Bushmen: Accessing Khwe Cultural Heritage Data by Means of a Digital Ontology Based on Owlnotator","2","",""
"6391","20","Crafting History: Using a Linked Data Approach to Support the Development of Historical Narratives of Critical Events","2","",""
"6392","20","How to create a Website and which Questions you have to answer first","2","",""
"6393","20","TOME: A Topic Modeling Tool for Document Discovery and Exploration","2","",""
"6394","20","devochdelia: el Diccionario Etimolójico de las Voces Chilenas Derivadas de Lenguas Indíjenas Americanas de Rodolfo Lenz en versión digital","2","",""
"6395","20","Traditional Humanities Research and Interactive Mapping: Towards a User-Friendly Story of Two Worlds Collide","2","",""
"6396","20","Animating Text Newcastle University","2","",""
"6397","20","Eliminar barreras para construir puentes a travès de la Web semántica : Isidore, un buscador trilingüe para las Ciencias Humanas y Sociales","2","",""
"6398","20","Creating a Digital Edition of Ancient Mongolian Historical Documents","2","",""
"6399","20","Augmenting the University: Using Augmented Reality to Excavate University Spaces","2","",""
"6400","20","Connecting Gaming Communities and Corporations to their History: The Gen Con Program Database","2","",""
"6401","20","La automatización y “digitalización” del Centro de Documentación Histórica “Lic. Rafael Montejano y Aguiñaga” de la Universidad Autónoma de San Luis Potosí, mediante la autogestión y software libre.","2","",""
"6402","20","Monroe Work Today: Unearthing the Geography of US Lynching Violence 
                     (Monroe Work Hoy en Día: Desenterrar la geografía de la violencia linchamieno de EEUU)","2","",""
"6403","20","An Easy-to-use Data Analysis and Visualization Tool for Studying Chinese Buddhist Literature","2","",""
"6404","20","Hacia la Traducción Automática de las Lenguas Indígenas de México","2","",""
"6405","20","CITE Exchange Format (CEX): Simple, plain-text interchange of heterogenous datasets","2","",""
"6406","20","Developing Digital Methods to Map Museum ""Soft Power""","2","",""
"6407","20","The CLiGS Textbox","2","",""
"6408","20","Humanities Commons: Collaboration and Collective Action for the Common Good","2","",""
"6409","20","Locating Place Names at Scale: Using Natural Language Processing to Identify Geographical Information in Text","2","",""
"6410","20","A Graphical User Interface for LDA Topic Modeling","2","",""
"6411","20","Milpaís: Una Wiki Semántica Para Recuperar, Compartir Y Construir Colaborativamente Las Relaciones Entre Plantas, Seres Humanos, Comunidades Y Entornos.","2","",""
"6412","20","Crowdsourcing Community Wellness: Coding a Mobile App For Health and Education","2","",""
"6413","20","Voces y Caras: Hispanic Communities of North Florida","2","",""
"6414","20","Academy of Finland Research Programme ""Digital Humanities"" (DIGIHUM)","2","",""
"6415","20","Mapping the Movida: Re-Imagining Counterculture in Post-Franco Spain (1975-1992)","2","",""
"6416","20","Empatía Digital: en los pixeles del otro.","2","",""
"6417","20","Using Linked Open Data To Enrich Concept Searching In Large Text Corpora","2","",""
"6418","20","Women’s Faces and Women’s Rights: A Contextual Analysis of Faces Appearing in Time Magazine","2","",""
"6419","20","Transatlantic knowledge production and conveyance in community-engaged public history: German History in Documents and Images/Deutsche Geschichte in Dokumenten und Bildern","2","",""
"6420","20","Bad Brujas Only: Digital Presence, Embodied Protest, and Online Witchcraft","2","",""
"6421","20","Endangered Data Week: Digital Humanities and Civic Data Literacy","2","",""
"6422","20","La geopólitica de las humanidades digitales: un caso de estudio de DH2017 Montreal","2","",""
"6423","20","Chromatic Structure and Family Resemblance in Large Art Collections — Exemplary Quantification and Visualizations","2","",""
"6424","20","The Iowa Canon of Greek and Latin Authors and Works","2","",""
"6425","20","Standing in Between. Digital Archive of Manuel Mosquera Garcés.","2","",""
"6426","20","ELEXIS: Yet Another Research Infrastructure. Or Why We Need An Special Infrastructure for E-Lexicography In The Digital Humanities.","2","",""
"6427","20","Propuesta Interdisciplinaria de un Juego Serio para la Divulgación de Conocimiento Histórico. Caso de Estudio: la divulgación del saber histórico sobre la vida conventual de los Carmelitas Descalzos del ex-Convento del Desierto de los Leones.","2","",""
"6428","20","Brecht Beats Shakespeare! A Card-Game Intervention Revolving Around the Network Analysis of European Drama","2","",""
"6429","20","A Tool to Visualize Data on Scientific Performance in the Czech Republic","2","",""
"6430","20","4 Ríos: una construcción transmedia de memoria histórica sobre el conflicto armado en Colombia","2","",""
"6431","20","Tensiones Entre El Archivo de Escritor Físico y El Digital: Hacia Una Aproximación Teórica","2","",""
"6432","20","A Comprehensive Image-Based Digital Edition Using CEX: A fragment of the Gospel of Matthew","2","",""
"6433","20","Princeton Prosody Archive: Rebuilding the Collection and User Interface","2","",""
"6434","20","An Ontological Model for Inferring Psychological Profiles and Narrative Roles of Characters","2","",""
"6435","20","Towards a Digital History of the Spanish Invasion of Indigenous Peru / Hacia una historia digital de la invasión española del Perú indígena","2","",""
"6436","20","Prospectiva de la arquitectura en el siglo XXI. La arquitectura en entornos digitales","2","",""
"6437","20","ANJA, ¿dónde están los encabalgamientos?","2","",""
"6438","20","Visualizando una Aproximación Narratológica sobre la Producción y Utilización de los Recursos Online de Museos de Arte.","2","",""
"6439","20","SpatioScholar: Annotating Photogrammetric Models","2","",""
"6440","20","Brâncuși’s Metadata: Turning a Graduate Humanities Course Curriculum Digital","2","",""
"6441","20","Off-line sStrategies for On-line Publications: Preparing the Shelley-Godwin Archive for Off-line Use","2","",""
"6442","20","More Than “Nice to Have”: TEI-to-Linked Data Conversion","2","",""
"6443","20","Bridging Digital Humanities Internal and Open Source Software Projects through Reusable Building Blocks","2","",""
"6444","20","Pontes into the Curriculum: Introducing DH pedagogy through global partnerships","2","",""
"6445","20","Una Investigación a Explotar : Los Cristianos de Alá, Siglos XVI y XVII.","2","",""
"6446","20","Shedding Light on Indigenous Knowledge Concepts and World Perception through Visual Analysis","2","",""
"6447","20","Lorenzetti Digital","2","",""
"6448","20","Legal Deposit Web Archives and the Digital Humanities: A Universe of Lost Opportunity?","2","",""
"6449","20","History for Everyone/Historia para todos: Ancient History Encyclopedia","2","",""
"6450","20","Decolonising Collections Information – Disrupting Settler Colonial Power In Information Management in response to Canada’s Truth & Reconciliation Commission and the United Nations Declaration on the Rights of Indigenous Peoples","2","",""
"6451","20","Tramando la palabra 
                     Weaving the Word","8","",""
"6452","20","Digital Experimentation, Courageous Citizenship and Caribbean Futurism 
                     Experimentación Digital, Ciudadanía Valiente y Futurismo Caribeño","8","",""
"6453","20","Mid-Range Reading: Manifesto Edition","3","",""
"6454","20","Bridging Between The Spaces: Cultural Representation Within Digital Collaboration and Production","3","",""
"6455","20","Reimagining the Humanities Lab","3","",""
"6456","20","Si Las Humanidades Digitales Fueran Un Círculo Estaríamos Hablando De La Circunferencia Digital","3","",""
"6457","20","Computer Vision in DH","3","",""
"6458","20","Precarious Labor in the Digital Humanities","3","",""
"6459","20","Beyond Image Search: Computer Vision in Western Art History","3","",""
"6460","20","Digital Chicago: #DH As A Bridge To A City’s Past","3","",""
"6461","20","Building Bridges With Interactive Visual Technologies","3","",""
"6462","20","The Impact of FAIR Principles on Scientific Communities in (Digital) Humanities. An Example of French Research Consortia in Archaeology, Ethnology, Literature and Linguistics.","3","",""
"6463","20","Social Justice, Data Curation, and Latin American & Caribbean Studies","3","",""
"6464","20","Remediating Machistán: Bridging Espacios Queer in Culturas Digitales, or Puentes over Troubled Waters","3","",""
"6465","20","Unanticipated Afterlives: Resurrecting Dead Projects and Research Data for Pedagogical Use","3","",""
"6466","20","Digital Humanities Pedagogy and Praxis Roundtable","3","",""
"6467","20","Digital Humanities and Colonial Latin American Studies","3","",""
"6468","20","Producción y Difusión de la investigación de las colecciones de archivos gráficos y fotográficos en el Archivo Histórico Riva-Agüero (AHRA)","3","",""
"6469","20","Critical Theory + Empirical Practice: “The Archive” as Bridge","3","",""
"6470","20","Experimental Humanities","3","",""
"6471","20","Global Perspectives On Decolonizing Digital Pedagogy","3","",""
"6472","20","Digital Humanities in Middle and High School: Case Studies and Pedagogical Approaches","3","",""
"6473","20","Perspectivas Digitales y a Gran Escala en el Estudio de Revistas Culturales de los Espacios Hispánico y Lusófono","3","",""
"6474","20","Networks of Communication and Collaboration in Latin America","3","",""
"6475","20","Project Management For The Digital Humanities","3","",""
"6476","20","Harnessing Emergent Digital Technologies to Facilitate North-South, Cross-Cultural, Interdisciplinary Conversations about Indigenous Community Identities and Cultural Heritage in Yucatán","3","",""
"6477","20","Pensar Filosóficamente las Humanidades Digitales","3","",""
"6478","20","Bridging Cultures Through Mapping Practices: Space and Power in Asia and America","3","",""
"6479","20","Justice-Based DH, Practice, and Communities","3","",""
"6480","20","Digital Decolonizations: Remediating the Popol Wuj","3","",""
"6481","20","DH in 3D: Multidimensional Research and Education in the Digital Humanities","3","",""
"6482","20","Las Humanidades Digitales en la Mixteca de Oaxaca: reflexiones y proyecciones sobre la Herencia Viva o Patrimonio","3","",""
"6483","20","Digital Humanities meets Digital Cultural Heritage","3","",""
"6484","20","Can Non-Representational Space Be Mapped? The Case of Black Geographies","3","",""
"6485","20","Legado de las/los latinas/os en los Estados Unidos: Proyectos de DH con archivos del Recovery.","3","",""
"6486","20","Large-Scale Accuracy Benchmark Results for Juola's Authorship Verification Protocols","9","",""
"6487","20","Integrating Latent Dirichlet Allocation and Poisson Graphical Model: A Deep Dive into the Writings of Chen Duxiu, Co-Founder of the Chinese Communist Party.","9","",""
"6488","20","Transposição Didática e atuais Recursos Pedagógicos: convergências para o diálogo educativo","9","",""
"6489","20","Adapting a Spelling Normalization Tool Designed for English to 17th Century Dutch","9","",""
"6490","20","Adjusting LERA For The Comparison Of Arabic Manuscripts Of _Kalīla wa-Dimna_","9","",""
"6491","20","Analyzing Social Networks of XML Plays: Exploring Shakespeare’s Genres","9","",""
"6492","20","Keeping 3D data alive: Developments in the MayaCityBuilder Project","9","",""
"6493","20","The Moral Geography of Milton's Paradise Lost","9","",""
"6494","20","Archivos digitales, cultura participativa y nuevos alfabetismos: La catalogación colaborativa del Archivo Histórico Regional de Boyacá (Colombia)","9","",""
"6495","20","A White-Box Model for Detecting Author Nationality by Linguistic Differences in Spanish Novels","9","",""
"6496","20","Locative Media for Queer Histories: Scaling up ""Go Queer""","9","",""
"6497","20","Interrogating the Roots of American Settler Colonialism: Experiments in Network Analysis and Text Mining","9","",""
"6498","20","Does ""Late Style"" Exist? New Stylometric Approaches to Variation in Single-Author Corpora","9","",""
"6499","20","Puesta En Mapa: La Literatura de México A Través De Sus Traducciones","9","",""
"6500","20","Measured Unrest In The Poetry Of The Black Arts Movement","9","",""
"6501","20","Mesurer Merce Cunningham : une expérimentation en « theatre analytics »","9","",""
"6502","20","Hurricane Memorial: The United States’ Racialized Response to Disaster Relief","9","",""
"6503","20","Critical Data Literacy in the Humanities Classroom","9","",""
"6504","20","Resolving the Polynymy of Place: or How to Create a Gazetteer of Colonized Landscapes","9","",""
"6505","20","Temporal Entity Random Indexing","9","",""
"6506","20","The Gallery of Queen Isabel in the Prado Museum, 1875-1877: Augmented Reality in 3D as a Research Method, Product and Pedagogical Tool/La Sala de la Reina Isabel en el Museo del Prado, 1875-1877: La realidad aumentada en 3D como método de investigación, producto y vehículo pedagógico 
                     http://prado.nfshost.com","9","",""
"6507","20","The History and Context of the Digital Humanities in Russia","9","",""
"6508","20","READ Workbench – Corpus Collaboration and TextBase Avatars","9","",""
"6509","20","Legacy No Longer: Designing Sustainable Systems for Website Development","9","",""
"6510","20","The Programming Historian en español: Estrategias y retos para la construcción de una comunidad global de HD","9","",""
"6511","20","Words that Have Made History, or Modeling the Dynamics of Linguistic Changes","9","",""
"6512","20","A Corpus Approach to Manuscript Abbreviations (CAMA)","9","",""
"6513","20","La creación del Repositorio Digital del Patrimonio Cultural de México","9","",""
"6514","20","Part Deux: Exploring the Signs of Abandonment of Online Digital Humanities Projects","9","",""
"6515","20","Cartonera Publishers Database, documenting grassroots publishing initiatives","9","",""
"6516","20","Next Generation Digital humanities: A Response To The Need For Empowering Undergraduate Researchers","9","",""
"6517","20","Conexiones Digitales Afrolatinoamericanas. El Análisis Digital de la Colección Manuel Zapata Olivella","9","",""
"6518","20","The Time-Us project. Creating gold data to understand the gender gap in the French textile trades (17th–20th century)","9","",""
"6519","20","Distinctions between Conceptual Domains in the Bilingual Poetry of Pablo Picasso","2","",""
"6520","20","Backoff Lemmatization as a Philological Method","9","",""
"6521","20","Afterlives of Digitization","9","",""
"6522","20","¿Metodologías en Crisis? Tesis 2.0 a través de la Etnografía de lo Digital","9","",""
"6523","20","Audiences, Evidence, and Living Documents: Motivating Factors in Digital Humanities Monograph Publishing","9","",""
"6524","20","Mapping And Making Community: Collaborative DH Approaches, Experiential Learning, And Citizens’ Media In Cali, Colombia","9","",""
"6525","20","Mitologias do Fascínio Tecnológico","9","",""
"6526","20","Media Preservation between the Analog and Digital: Recovering and Recreating the Rio VideoWall","9","",""
"6527","20","Spotting the Character: How to Collect Elements of Characterisation in Literary Texts?","9","",""
"6528","20","The Purpose of Education: A Large-Scale Text Analysis of University Mission Statements","9","",""
"6529","20","An Archaeology of Americana: Recovering the Hemispheric Origins of Sabin’s Bibliotheca Americana to Contest the Database’s (National) Limits","9","",""
"6530","20","Indagando La Cultura Impresa Del Siglo XVIII Novohispano: Una Base De Datos Inédita","9","",""
"6531","20","Verba Volant, Scripta Manent: An Open Source Platform for Collecting Data to Train OCR Models for Manuscript Studies","9","",""
"6532","20","IncipitSearch - Interlinking Musicological Repositories","9","",""
"6533","20","Novas Faces Da Arte Política: Ações Coletivas E Ativismos Em Realidade Aumentada","9","",""
"6534","20","Towards Linked Data of Bible Quotations in Jewish Texts","9","",""
"6535","20","Corpus Linguistics for Multidisciplinary Research: Coptic Scriptorium as Case Study","9","",""
"6536","20","Unwrapping Codework: Towards an Ethnography of Coding in the Humanities","9","",""
"6537","20","The (Digital) Space Between: Notes on Art History and Machine Vision Learning","9","",""
"6538","20","Dal Digital Cultural Heritage alla Digital Culture. Evoluzioni nelle Digital Humanities","9","",""
"6539","20","The Diachronic Spanish Sonnet Corpus (DISCO): TEI and Linked Open Data Encoding, Data Distribution and Metrical Findings","9","",""
"6540","20","A formação de professores/pesquisadores de História no contexto da Cibercultura: História Digital, Humanidades Digitais e as novas perspectivas de ensino no Brasil.","9","",""
"6541","20","OCR’ing and classifying Jean Desmet’s business archive: methodological implications and new directions for media historical research","9","",""
"6542","20","The Latin American Comics Archive: An Online Platform For The Research And Teaching Of Digitized And Encoded Spanish-Language Comic Books Through Scholar/Student Collaboration","9","",""
"6543","20","Humanidades Digitales en Cuba: Avances y Perspectivas","9","",""
"6544","20","Histonets, Turning Historical Maps into Digital Networks","9","",""
"6545","20","Corpus Jurídico Hispano Indiano Digital: Análisis De Una Cultura Jurisdiccional","9","",""
"6546","20","Digital Humanities Integration and Management Challenges in Advanced Imaging Across Institutions and Technologies","9","",""
"6547","20","The Digital Ghost Hunt: A New Approach to Coding Education Through Immersive Theatre","9","",""
"6548","20","REED London and the Promise of Critical Infrastructure","9","",""
"6549","20","Balanceándonos entre la aserción de la identidad y el mantenimiento del anonimato: Usos sociales de la criptografía en la red","9","",""
"6550","20","The Poetry Of The Lancashire Cotton Famine (1861-65): Tracing Poetic Responses To Economic Disaster","9","",""
"6551","20","Finding Data in a Literary Corpus: A Curatorial Approach","9","",""
"6552","20","Towards a Metric for Paraphrastic Modification","9","",""
"6553","20","Peer Learning and Collaborative Networks: On the Use of Loop Pedals by Women Vocal Artists in Mexico","9","",""
"6554","20","Flexibility and Feedback in Digital Standards-Making: Unicode and the Rise of Emojis","9","",""
"6555","20","The 91st Volume — How the Digitised Index for the Collected Works of Leo Tolstoy Adds A New Angle for Research","9","",""
"6556","20","Expanding the Research Environment for Ancient Documents (READ) to Any Writing System","9","",""
