"id","conference","title","work_type","url","parent_session"
"1","1","Writing about It: Documentation and Humanities Computing","1","",""
"2","1","Integration of Markup Languages and Object-Oriented Techniques in a Hypermedia Methodology","1","",""
"3","1","A Workbook Application for Digital Text Analysis","1","",""
"4","1","The Middle English Grammar Project","1","","7169"
"5","1","Two Historical Linguistic Atlases","1","","7169"
"6","1","WebCAPE - Language Placement Testing over the Web","1","",""
"7","1","Technophobes, or the Nintendo Generation? A Study of the Use of ICT in Teaching and Learning in Modern Languages","1","",""
"8","1","Computer-Aided Acquisition of Language Teaching Materials from Corpora","1","",""
"9","1","Records to Go: Building the Humbul Humanities Hub","2","",""
"10","1","LOOKSEE: Software Tools for Image-Based Humanities Computing","2","",""
"11","1","A Wake Newslitter - Electronic Edition","2","",""
"12","1","Modeling the Crystal Palace","2","",""
"13","1","Solutions for the Delivery of Thematically-Tagged Text","1","",""
"14","1","Meaning and Interpretation of Markup","1","",""
"15","1","A Formal Model for Lexical Information","1","",""
"16","1","Teaching Cybertext Writing, Design, and Editing: Language, Image, Linking, Thinking","1","",""
"17","1","A Toolbox for the Electronic Classroom","1","",""
"18","1","Ekphrasis and the Internet: Connecting the Verbal and the Visual with Computer-mediated Student Projects in an Undergraduate Humanities Class","1","",""
"19","1","SMART Project: Methods for Computer-based Research of Premodern Chinese Texts","1","",""
"20","1","Word Order in Latin Prose Applied to a Case of Authorship Attribution: Book IV of the Stratagemata by Sextus Iulius Frontinus (1st century AD). The Contribution of Quantitative Methods via Computerized Text Analysis","1","",""
"21","1","Back to the Cave of Shadows: Stylistic Fingerprints in Authorship Attribution","1","",""
"22","1","The Digital Performance Archive","2","",""
"23","1","An Assistant Tool for Verse-making in Basque-based on Two-Level Morphology","2","",""
"24","1","The Second Version of the ICAME CD-ROM","2","",""
"25","1","Working with Alignment of Text and Sound in Spoken Corpora","2","",""
"26","1","Text Structure vs. Encoded Structure - Dealing with Mixed Genres and Ambiguous Texts","1","",""
"27","1","Perdita's Progress: Raising Standards in a TEI-based Approach to Cataloguing Early Modern Manuscripts","1","",""
"28","1","Image Description at the William Blake Archive","1","",""
"29","1","Kirrkirr: Software for Browsing and Visual Exploration of a Structured Warlpiri Dictionary","1","",""
"30","1","New Paths in Middle High German Lexicography: Dictionaries Interlinked Electronically","1","",""
"31","1","Stephen Crane and the 'New-York Tribune': a Case Study in Traditional and Non-traditional Authorship Attribution","1","",""
"32","1","Making MITH a Reality: The Maryland Institute for Technology in the Humanities, Year Two","3","",""
"33","1","EDINA: Edinburgh Data and Information Access","2","",""
"34","1","A Prolog System for the Automatic Generation of Bilingual Dictionaries","2","",""
"35","1","Humanities Computing and Campus Computer/Information literacy","2","",""
"36","1","John Venn and the Alumni Cantabrigienses - an example of applied natural language processing techniques in enhancing the utility of a historical database","2","",""
"37","1","The ""Biblioteca Italiana Telematica"" Project (http://cibit.unipi.it): a Progress Report","1","",""
"38","1","Poetic Prosthetic","1","",""
"39","1","An American National Corpus: a Large Balanced Text Corpus for American English","1","",""
"40","1","Electric Theory (Truth, Use, and Method)","1","","7168"
"41","1","French Neo-Structuralist Schools and Industrial Text Analysis","1","","7168"
"42","1","A Theory for Literature (Created for the World Wide Web, E-Mail, Chat Spaces, Databases, and Other Electronic Technologies)","1","","7168"
"43","1","Computer-Mediated Discourse, Reception Theory, and Versioning","1","","7168"
"44","1","The FALMER Project: Toward an Electronic Critical Edition","1","",""
"45","1","The Miguel Cervantes Digital Library: The Hispanic Voice on the WEB","1","",""
"46","1","Textual Variation, Electronic Editions and Hypertext","1","",""
"47","1","Computing in the School of English and Scottish Language And Literature (SESLL) at the University of Glasgow","2","",""
"48","1","Experience and Expertise: The Humanities Advanced Technology and Information Institute, University of Glasgow","2","",""
"49","1","A Case Study of an Evaluation Questionnaire Concerning the Integration of a Hypermedia Project in University Courses","2","",""
"50","1","Collaborative Campus: Rhetoric, Technology and Classroom Re-Composition","2","",""
"51","1","Machine Learning Support for Evaluation and Quality Control","1","",""
"52","1","A Corpus-Based Methodology for Identifying Non-nominal ""It"": Rule-Based and Machine Learning Approaches","1","",""
"53","1","Binomials and the Computer: a Study in Corpus-Based Phraseology","1","",""
"54","1","ACAD - a Cambridge Alumni Database","1","",""
"55","1","New Models for Electronic Publishing","1","",""
"56","1","Academic Collaboration On Line: The SOL as a Case Study","1","",""
"57","1","Dating Dickinson: an Experimental Approach to Stylochronometry","2","",""
"58","1","A Comparison of Methods for the Attribution of Authorship of Popular Fiction","2","",""
"59","1","Computational Methods for the Study of Multilingual Corpora","2","",""
"60","1","A System for Dynamic Text Corpus Management (with an Example Corpus of the Russian Mass Media of the 1990s)","2","",""
"61","1","XSL - Characteristics, Status, and Potentials for Text Processing Applications in the Humanities","1","",""
"62","1","Metainformation Strategies for Electronic Resources","1","",""
"63","1","On Mock-scholarly, Faux-casual, and Cod Philosophy: Patterns of Diachronic Change in a British Newspaper","1","",""
"64","1","Primroses and Power: a Study on Linguistic Excellence in Political Discourse","1","",""
"65","1","The Statistical Analysis of Style: How Language Means in Beckett","1","",""
"66","1","Border Crossing: Engineers, Papyrologists, and the Graphical Use Interface","1","",""
"67","1","Trajan's Column: Building a WWW Image-Database","1","",""
"68","1","Digital Images for Online Distance Education in the Humanities","1","",""
"69","1","Books into Bytes: The ""Deutsches Wörterbuch"" on CD-ROM and on the Internet","2","",""
"70","1","Construction of Russian Corpus-Driven Dictionary Based and Monitor Corpora","2","",""
"71","1","The MATE Workbench - a Tool for XML Corpus Annotation","2","",""
"72","1","Austrian Academy Corpus - Doing literary markup by means of XML","2","",""
"73","1","The Humanities Computing Job Market","3","",""
"74","1","Textbases and Databases: Integrating Library Catalogs with Digital Libraries","1","",""
"75","1","Mapping 18th Century Structures of Knowledge: the Renvois System in Diderot's Encyclopédie","1","",""
"76","1","Multi Dimensions Concept-Based Information Retrieval System","1","",""
"77","1","Image Analysis as a Tool for Automating the Integration of Editorial Hypertext with Facsimile-based Digital Editions: the Experience of the Electronic Edition of Ruskin's Modern Painters I","1","",""
"78","1","Automatical Text Aligning in a Parallel Text Corpus","2","",""
"79","1","A Pilot Study in the Use of E-Books for Learning","2","",""
"80","1","Developing and Teaching with Computer-based Courseware in History: the History Courseware Consortium","2","",""
"81","1","Griffith in Context: a Multimedia Exploration of The Birth of a Nation","2","",""
"82","1","Developing a User Interface for the Historical Thesaurus of English Ingres Database","1","","7841"
"83","1","The Electronic Scottish National Dictionary: Work in Progress","1","","7841"
"84","1","Early Dictionaries of English and Historical Corpora","1","","7841"
"85","1","Supporting Digital Scholarship: a Project Funded by the Andrew W. Mellon Foundation","3","",""
"86","1","The Role of the Scholarly Associations in Humanities Education","3","",""
"87","1","New Tools for Learners","2","",""
"88","1","Enriching Drawing","2","",""
"89","1","Caught in the Decameron Web: New Tools for Scholars and Teachers","2","",""
"90","1","Like a Bird on a Wire: WWW and Remote Learners in British Columbia","2","",""
"91","1","On Consensus between Tree-representations of Linguistic Data","1","",""
"92","1","An Electronic Lexicon of Nominalizations: NOMLEX","1","",""
"93","1","CAT : A Jurilinguistic Application of Automatic Speech to Text Transcription","1","",""
"94","1","Shouting and Screaming: Manner and Noise Verbs in Communication","1","",""
"95","1","The Style-Marker Mapping Project: a Rationale and Progress Report","1","",""
"96","1","Comparative Study of the Lexical and Orthographic Variety in the Mediæval Slavonic Psalter","1","",""
"97","1","Subject Specific Search Engines for the Humanities","2","",""
"98","1","The Academic vs. Subject Corpus: Development of Criteria for the Teaching of ESP According to Lexical Needs in Spanish Polytechnic Courses","2","",""
"99","1","Hyperfiction Reading Research: An Experiment in Method","2","",""
"100","1","Hyperlectures: Teaching Postmodern Culture on the Web","2","",""
"101","1","Preservation of Emotional Tone Patterns In Human and Machine Translations Between English and French","2","",""
"102","2","Reality Check: Projects and Prospects in Digital Humanities","8","",""
"103","2","What's Interesting for Humanities Computing About Whitman's Poetry Manuscripts?","3","",""
"104","2","Beyond the Web: TEI and the Ebook Revolution""","1","",""
"105","2","Dancing with DALF: Towards a Digital Archive of Letters written by Flemish authors and composers in the 19th and 20th century","1","",""
"106","2","Introducting Phelix: an open XML database system","1","",""
"107","2","International Strategic & Policy Issues in Networking Digital Resources in the Humanities","3","",""
"108","2","Image Retrieval Knowledge and Art History Curriculum in the Digital Age","1","",""
"109","2","Mimetic Metadata: Linguistic Representations of Visual Objects in Image-Based Electronic Projects","1","",""
"110","2","Digital Pedagogy in Film and Media Studies","1","",""
"111","2","Building flexible language-learning systems: Perl and HTML vs. XML and XSL","1","",""
"112","2","The Time Course of Language Change","1","",""
"113","2","Building spell-checking facilities for ancient Spanish","1","",""
"114","2","The Evolution of Standard written English: A Corpus approac","1","",""
"115","2","By the Orlando Project","1","",""
"116","2","The DIY commentary; or, what the reference and the link told each other","1","",""
"117","2","NGSW: Putting Voices Online","1","",""
"118","2","Creating Reflecting Interfaces: Discipline, Project, and Audience Specific Internet Archives","1","",""
"119","2","Forensic Technologies and the Tracing of Identities","1","",""
"120","2","Disciplining the Traditional Student Subject in Computer-Composition","1","",""
"121","2","The W3C Consortium and Standards","3","",""
"122","2","The MA in Electronic Communication and Publishing at UCL","1","",""
"123","2","The M.Phil in History and Computing at the University of    Glasgow","1","",""
"124","2","Toward a Dynamic, Generative Evaluation Toolbox: a Roundtable","3","",""
"125","2","Categorisation techniques in computer assisted reading and analysis of texts (CARAT) in the humanities","1","",""
"126","2","Reconstructing the stemma of a textual tradition from the order of sections in manuscripts","1","",""
"127","2","Co-Cited Author Maps as Real-Time Interfaces for  Web-Based Document Retrieval in the Humanities","1","",""
"128","2","More than Words: Astonishment and Special Effect in Multimedia","1","",""
"129","2","An e|mediated rhetoric of visuality","1","",""
"130","2","TEvent 1: e|mediated typo|graphicacy 'Funny Signs' was an Acrobat 'visual lecture' for graphic design students, comprising firstly, a 'paper' on semiotic [de]sign-as-ideology, written and designed as screen-statements of 7-30 words (with occasional hidden rollovers), in large white text on a black background (36 point size on the original Quark XPress). The second part was a 'slideshow' of abou...","1","",""
"131","2","The Visual Display of Literary Complexity in a Hypertext Critical Edition of William Faulkner's The Sound and the Fury","1","",""
"132","2","Immersive Textuality: The Editing of  Virtual Spaces","1","",""
"133","2","The Pompey Project: Digital Research and Virtual Reconstruction of Romes First Theatre","1","",""
"134","2","From mathematical classification to thematic analysis of philosophical texts","1","",""
"135","2","Linguistic Description and Exploration using RDF","1","",""
"136","2","OpenText.org: An Experiment in Internet-based Collaborative  Humanities Scholarship","1","",""
"137","2","The Virtual Lightbox: The Potential of Peer-to-Peer Humanities Computing","1","",""
"138","2","A New Framework for Web-based Contributory Encyclopedias","1","",""
"139","2","Digitizing Difference: The Challenge of Heterogeneity in the Sources of Early Modern Science","3","",""
"140","2","Information extraction with INTEX","1","",""
"141","2","Parsing words and sentences ambiguous between opposite meanings using INTEX finite state grammars: You cant take ambiguity too seriously","1","",""
"142","2","Parsing a Web site with linguistic resources : GlossaNet","1","",""
"143","2","Practical extraction of meaning from markup using XSLT","1","",""
"144","2","Automatic DTD simplification by examples","1","",""
"145","2","The Historical Event Mark-up and Linking Project","1","",""
"146","2","The Genre of Electronic Communication: A Virtual Barbecue Revisited","1","",""
"147","2","Tracking Culture on the Web; An Experiment","1","",""
"148","2","USING NATURAL LANGUAGE PROCESSING TECHNIQUES FOR MUSICAL PARSING","1","",""
"149","2","INTEX Solves Pronunciation and Intonation Problems in Text to Speech Reading Machines","1","",""
"150","2","Extracting multilingual lexicons from parallel corpora","1","",""
"151","2","Vocabulary Richness and Authorship Reconsidered","1","",""
"152","2","A Widow and Her Soldier: The Case of the Pickett Letters","1","",""
"153","2","Overview of Supporting Digital Scholarship Project","1","",""
"154","2","The Salisbury Project: Collecting an Existing Digital Resource","1","",""
"155","2","Planning Obsolescence: Dynamic Architectures for Digital Scholarship","1","",""
"156","2","Collecting Existing HTML Web Sites","1","",""
"157","2","Putting the dialog back together : Re-creating structure in letter publishing","1","",""
"158","2","The Decameron Web. How does encoding help pedagogy?","1","",""
"159","2","Versions of Interactivity: Meta-interpretive Response in Hypertext Fiction","1","",""
"160","2","3D Imaging and Processing of Damaged Texts","1","",""
"161","2","The Order of the Canterbury Tales:  Praxis of Computer Analysis","1","",""
"162","2","Reading the Papyrologist: Building Systems to Aid the Humanities Expert Keywords: Papyrology, Knowledge Elicitation, Cognitive Systems","1","",""
"163","2","Markup vs. Character Encoding: The quandary of handling the epigraphical/papyrological ""underdot"" in computer representation","2","",""
"164","2","Form or Function: Considerations in Presenting Historical Documents on the Web","2","",""
"165","2","Technical aspects of the production process of digital books using XML-TEI at the Miguel de Cervantes digital library","2","",""
"166","2","PhiloNet: creating semantic concordances for the analysis of         philosophical texts","2","",""
"167","2","AAC - Digital Resources in Textual Studies","2","",""
"168","2","Czech Approaching English : Verbal Forms With Personal Pronouns Across Styles in the Czech National Corpus","2","",""
"169","2","Phraseological Database Extended by Educational Material for Learning Scientific Style","2","",""
"170","2","Sharing expertise in the use of information and communication technology to enhance teaching and learning in the humanities","2","",""
"171","2","Job Seeking in Humanities Computing","2","",""
"172","2","Remote Interactive Animated Projection","2","",""
"173","2","Building Belphegor: A Multilingual Electronic Journal using TEI","2","",""
"174","2","Experiments in Multivariate Analysis and Authorship Attribution","2","",""
"175","2","What can Hyperplane-Classifiers tell us about Texts?What can Hyperplane-Classifiers tell us about Texts?","2","",""
"176","2","Music via Motion: Interactive Multimedia Performances","2","",""
"177","2","Optical Music Recognition: Stroke Tracing and Reconstruction of Handwritten Manuscripts","2","",""
"178","2","The Norwegian Museum Project","2","",""
"179","2","Revisiting Revisions: employing XML and XSL to display deeply encoded, multi-versioned text","2","",""
"180","2","Cultures and Literacies: South African students and Western Visual design on the World Wide Web","2","",""
"181","2","A  Masters Degree in Digital Humanities at the University of Virginia","1","",""
"182","2","Using the TEI to author web sites","1","",""
"183","2","Typographic Regularization in the WWP Textbase","1","",""
"184","2","TEI and Topic Maps","1","",""
"185","2","Symbiosis or serfdom?...""Are you/we/they being Served?""","1","",""
"186","2","Publishing originally digital scholarship at the University of Virginia","1","",""
"187","2","Towards a Politics of Text Encoding","1","",""
"188","2","Electronic Publishing and Academic Credibility","1","",""
"189","2","TEI for Better or Verse","1","",""
"190","2","Rhythm and metre in Italian Renaissance narrative verse","1","",""
"191","2","Time series modelling in the analysis of Greek metrics","1","",""
"192","2","The Adaption and Breakthrough of Chinese Documents Encoding  A Case Study of CBETA Digital Tripitaka and TEI","1","",""
"193","2","Automatic XML Mark-Up","1","",""
"194","2","Linking and Gathering: Automatic Hypertext in the Perseus Digital Library","1","",""
"195","2","The Tribe of Cool: Information Culture and History","8","",""
"196","3","Systemic Functional Hypertexts","1","",""
"197","3","The Myth of Roland and Its Function as Cultural Hypertext as Expressed in 'RolandHT'","1","",""
"198","3","Query Visualization, Markup, and a Region-based Document Model","1","",""
"199","3","Handing it Down: a survey of the use of tradition in French and English from the 16th to the 20th centuries","1","",""
"200","3","Charles Brockden Brown: Quantitative Analysis and Narrative Voice","1","",""
"201","3","There is Virtue in Virtuality. Future potentials of electronic humanities scholarship","1","",""
"202","3","Multiple Architectures and Multiple Media: The Salem Witch Trials and Boston's Back Bay Fens Projects","3","",""
"203","3","Human-machine communication by voice (A multimedia tutorial for linguists and engineers)","1","",""
"204","3","The virtual classroom: Videoconferencing for foreign language learners","1","",""
"205","3","Just-in-Time-Teaching in the Humanities: Lessons Learned from the Web Cahier","1","",""
"206","3","New Directions in Statistical Stylistics and Authorship Attribution","1","",""
"207","3","'DNA' and Non-traditional Authorship Attribution: An Inclusive Model","1","",""
"208","3","Stylometric Analysis Using Discriminant Analysis: A Study of Sherlock Holmes Stories","1","",""
"209","3","MITH's Lean, Mean Versioning Machine","3","",""
"210","3","Towards a Rhetoric of Hypertext: A Case Study in Adaptive Literature","1","",""
"211","3","Imaging and amanuenses: understanding the Manuscript of De Doctrina Christiana, attributed to John Milton","1","",""
"212","3","The Scottish Corpus of Texts and Speech: problems of corpus design","1","",""
"213","3","The Meta Dictionary","1","",""
"214","3","The Open Language Archives Community: An Infrastructure for Distributed Archiving of Language Resources","1","",""
"215","3","Forensic linguistics: the contribution of humanities computing","1","",""
"216","3","Structure of the Frequency of Occurrence of Consonants in the Speech Sound Chain as an Indicator of the Phono-Typological Closeness of Languages","1","",""
"217","3","LEMMA3 - a Primarily Wordform Based Wordclass Tagger and Lemmatizer for Unrestricted German Texts","1","",""
"218","3","Ordering Chaos: A Virtual Archive of Whitman Poetry Manuscripts","1","",""
"219","3","Jigsaw Puzzles: Problem B","1","",""
"220","3","Encoding of glyph variants - some preliminary experiments","1","",""
"221","3","METS: The Metadata Encoding Transmission Standard","3","",""
"222","3","Crunching numbers in the 'Night Watches of Bonaventura': A computer-aided contribution to author's lexicography","2","",""
"223","3","Internet Assistant","2","",""
"224","3","Organizing Multimedia Inter-textual Knowledge: New Tasks, Challenges and Technologies","2","",""
"225","3","DiCoMo: A cost estimation model for digitization projects","2","",""
"226","3","The encoding of Ibsen's manuscripts for ""Emperor and Galilean""","2","",""
"227","3","Shuhai Wenyuan Interactive Internet Worktable: Studying Ancient Chinese Philosophy On-Line","2","",""
"228","3","Classrooms, computer labs, and remote locations: Integrating the three spaces of computer aided interactive writing courses","2","",""
"229","3","Music Information Retrieval: Examining what we mean by success.","2","",""
"230","3","Prognostics of English Verb Paradigm Evolution","2","",""
"231","3","Towards declarative descriptions of transformations: An approach based on topic maps","2","",""
"232","3","Mots15 - An interactive concordance system (built from mostly off-the- shelf parts)","2","",""
"233","3","Document management system for supporting historians","2","",""
"234","3","Rich Textual Metadata: Implementation and Theory","2","",""
"235","3","SCHOLIA: a web-based reading tool for the study of language and literature","2","",""
"236","3","Element classes in contextually specified document structures","2","",""
"237","3","System for Automatic Building of a Representative Corpus Using Internet","2","",""
"238","3","The Proposed Companion to Humanities Computing","2","",""
"239","3","Building and processing a multilingual corpus of parallel texts","2","",""
"240","3","The Web Cahier: A Tool For Implementing Just-in-Time-Teaching In the Humanities","2","",""
"241","3","Facet analytical theory as a basis for a subject organization tool in a humanities portal","1","",""
"242","3","The name of the place: towards a model for interconnection of geographical entities","1","",""
"243","3","Facilitating Text Analysis in Russian Culture: TEI or Topic Maps?","1","",""
"244","3","The Austrian Academy Corpus - Digital Resources and Textual Studies","1","",""
"245","3","The electronic publication of archaeological field reports using XML","1","",""
"246","3","That Was Then: Canonicity in the Trésor","1","",""
"247","3","Making Advanced Scholarly Editions","1","",""
"248","3","Some considerations on a framework for electronic editions","1","",""
"249","3","A rediscovered Llull tract and the Augsburg Web edition of Llull's electoral writings","1","",""
"250","3","New Philology and New Phylogeny. Aspects of a critical electronic edition of Wolfram's 'Parzival'","1","",""
"251","3","Reconceiving Text Analysis","3","",""
"252","3","XML Content Integration: An Example from the Heml Project","1","",""
"253","3","Skeletons in the closet: Saying what markup means","1","",""
"254","3","Meaning and interpretation of concurrent markup","1","",""
"255","3","The Ivanhoe Game","3","",""
"256","3","A logic programming environment for document semantics and inference","1","",""
"257","3","Visualizing Overlapping Hierarchies in Textual Markup","1","",""
"258","3","A computational model for MLCD","1","",""
"259","3","Bridging disciplinary boundaries: A case study of the Music Information Retrieval Annotated Bibliography Project","1","",""
"260","3","Building a multimedia haiku dictionary","1","",""
"261","3","Interpreting Animation and Vice Versa: Can We Philosophize in Flash?","1","",""
"262","3","Into the Depths of Data. Methods of Subject Specific Content Retrieval","3","",""
"263","3","New Directions in Interdisciplinary Electronic Pedagogy: Practice, Process, Products","3","",""
"264","3","An hypothesis of formalization of literary data for text analysis: a case study on Karl Kraus' writings","1","",""
"265","3","Mapping Differences in 1st Century Greek Style","1","",""
"266","3","Computer Philology: 'Wissenschaft' or 'Hilfswissenschaft'?","1","",""
"268","4","On Determining a Valid Text for Non-Traditional Authorship Attribution Studies: Editing, Unediting, and De-Editing","1","",""
"270","4","Temporal Modelling","1","",""
"271","4","Virtual Vaudeville: A Live Performance Simulation System","1","",""
"272","4","Tagging Time in PROLOG: from quick and dirty to TEI","1","",""
"273","4","Creating a Virtual Center as an International Web-Based Interactive Infrastructure for Research and Teaching in the Language Sciences: A new Research and Library collaboration","1","",""
"274","4","Chinese Collections in Museums on the Web: Current Status, Problems, and Future","1","",""
"275","4","New Technologies, New Strategies for Integrating Information and Knowledge: Forced Migration Online","1","",""
"276","4","Data or Document? Migration of Descriptive Metadata for Medieval and Renaissance Manuscripts Between Data-Centric and Document-Centric Models: A Case Study","1","",""
"277","4","The Charles W. Cushman Collection: Enhancing Visual Resource Discovery Through Descriptive Metadata Based on Subjective Image Analysis","1","",""
"278","4","Preservation of the New Media Arts","1","",""
"279","4","The Screen or the Window: A Critical Proposal for Reading Computer Representations","1","",""
"280","4","Visual or Verbal: Two Approaches to Creating an Immersive Virtual Environment","1","",""
