"id","conference","title","work_type","url","parent_session"
"2071","15","STAK - Serendipitous Tool for Augmenting Knowledge: Bridging Gaps between Digital and Physical Resources","10","",""
"2072","15","Starting the Conversation: Literary Studies, Algorithmic Opacity, and Computer-Assisted Literary Insight","10","",""
"2073","15","Student Collaborators in Digital Humanities Outreach and Advocacy: Strategies and Examples from the IDHMC at Texas A&M University","9","",""
"2074","15","Stylometry of Collaborations: Dickens, Collins and their collaborative writings","10","",""
"2075","15","Stylometry, Network Analysis, and Latin Literature","2","",""
"2076","15","Supporting ""Distant Reading"" for Web Archives","10","",""
"2077","15","Supporting cross-media analyses by automatically linking multiple collections","2","",""
"2078","15","Sustainability?! Four Paradigms for Humanities Data Centers","2","",""
"2079","15","Swiss Voice App: A smartphone application for crowdsourcing Swiss German dialect data","9","",""
"2080","15","SyMoGIH project and Geo-Larhra: A method and a collaborative platform for a digital historical atlas","9","",""
"2081","15","Taco: A Metadata System for Hierarchical Structured Data Collections","2","",""
"2082","15","Taking a Global Perspective on the Skills and Competencies Important to Digital Scholarship","2","",""
"2083","15","Taking manuscripts apart, and putting them together","2","",""
"2084","15","TEI Customization for enconding paratexts in spanish printed books (XV-XVIII)","2","",""
"2085","15","Text Mining Plato's Dialogues","9","",""
"2086","15","TextGrid: Creating, publishing and archiving digital editions and other data from the arts and humanities via a Virtual Research Environment and its repository","2","",""
"2087","15","The Ancient Coins of Thrace: A Numismatic Web Portal","9","",""
"2088","15","The Annotated Star: A Collaborative Digital Edition of Rosenzweig's Star of Redemption","2","",""
"2089","15","The Arabic Papyrology Database","2","",""
"2090","15","The CENDARI Project: A user-centered 'enquiry environment' for modern and medieval historians","2","",""
"2091","15","The Changing Canon of Beauty: Facial Attractiveness in the Representation of Human Faces in World Painting","10","",""
"2092","15","The Chimeria Platform: User Empowerment through Expressing Social Group Membership Phenomena","10","",""
"2093","15","The Cryptic Novel: A Computational Taxonomy of the Eighteenth-Century Literary Field","10","",""
"2094","15","The CWRC-Writer Bridge: from Coder to Writer, XML to RDF, DH to Mainstream","2","",""
"2095","15","The Development of The Dickens Lexicon Digital and its Practical Use for the Study of Late Modern English","2","",""
"2096","15","The DigiPal Framework for Script and Image","2","",""
"2097","15","The Digital Alchemist: A Mixed Reality Exploration of Jonson's Alchemist as Site-Specific Theatre","2","",""
"2098","15","The dog that didn't bark: A longitudinal study of reading behaviour in physical and digital environments","10","",""
"2099","15","The Early Modern OCR Project (eMOP): Fostering Access to Early Modern Cultural Materials","2","",""
"2100","15","The Inherited Self: Reappraising Literary Cultural Heritage through Digital Methods","2","",""
"2101","15","The Landscapes of Casta Paintings: Depictions of Social Anxieties in XVIII Century New Spanish Art","10","",""
"2102","15","The Layered Text. From Textual Zoom, Text Network Analysis and Text Summarisation to a Layered Interpretation of Meaning","10","",""
"2103","15","The MAAYA Project: Multimedia Analysis and Access for Documentation and Decipherment of Maya Epigraphy","9","",""
"2104","15","The MiCLUES system: Dynamic, rich contextual support for museum visits","2","",""
"2105","15","The Open Philology Project at the University of Leipzig","2","",""
"2106","15","The opportunistic librarian: A Leuven confession","9","",""
"2107","15","The potential of open computer-mediated communication channels to facilitate collaboration in geographically disbursed collaborations","9","",""
"2108","15","The Problem of Time and Space: The Difficulties in Visualising Spatiotemporal Change in Historical Data","10","",""
"2109","15","The Proportional Sizes of Genres in Eighteenth- and Nineteenth-Century English-Language Books","2","",""
"2110","15","The Rowling Case: A Proposed Standard Analytic Protocol for Authorship Questions","10","",""
"2111","15","The Scholarly 3D Toolkit: Annotation, Publication, and Analysis of 3D Scenes alongside Imported Humanities Data","10","",""
"2112","15","The SMART-GS Project: An Approach to Image-based Digital Humanities","2","",""
"2113","15","The social pleasure of the text: Applying digital humanities methods to reception studies","10","",""
"2114","15","The Stanford Literary Lab Transhistorical Poetry Project Phase II: Metrical Form","10","",""
"2115","15","The Story of Stopwords: Topic Modeling an Ekphrastic Tradition","10","",""
"2116","15","The SyMoGIH project : Sharing and publishing historical and geographical data in a standard, open and interoperable way","2","",""
"2117","15","The Telltale Hat: LDA and Classification Problems in a Large Folklore Corpus","10","",""
"2118","15","The Workspace for Collaborative Editing","10","",""
"2119","15","TheofPhilo. A prototype for a Thesaurus of Philosophy","9","",""
"2120","15","Topotime: Representing historical temporality","10","",""
"2121","15","Towards a Semantic Network of Dante's Works and Their Contextual Knowledge","9","",""
"2122","15","Towards an Archaeology of Text Analysis Tools","10","",""
"2123","15","Towards visualizing linguistic patterns of deliberation: a case study of the S21 arbitration","9","",""
"2124","15","Tracing Workflow of a Digital Scholar","10","",""
"2125","15","Tracking Semantic Drift in Ancient Languages: The Bible as Exemplar and Test Case","10","",""
"2126","15","Trading Consequences: A Case Study of Combining Text Mining & Visualisation to Facilitate Document Exploration","10","",""
"2127","15","Transcribo: A Graphical Editor for Transcribing and Annotating Textual Witnesses. Preparing a Historical-Critical Edition of Arthur Schnitzler's Works.","2","",""
"2128","15","Transcriptional implicature: a contribution to markup semantics","10","",""
"2129","15","Treasure Challenge: an archaeological video conferencing journey","9","",""
"2130","15","Tuning the Word Frequency List","10","",""
"2131","15","Two Irish Birds: A Stylometric Analysis of James Joyce and Flann O'Brien","10","",""
"2132","15","Two new tools for multimodal editions","9","",""
"2133","15","Uncertain about Uncertainty: Different ways of processing fuzziness in digital humanities data","9","",""
"2134","15","Unhappy? There's an App for That: Digital Happiness, Data Mining, and Networks of Well-Being","10","",""
"2135","15","User-friendly lemmatization and morphological annotation of Early New High German manuscripts","2","",""
"2136","15","Using Computer Vision to Improve Image Metadata","10","",""
"2137","15","Using digitized newspaper archives to investigate identity formation in long-term public discourse","9","",""
"2138","15","Using Social Network Analysis to Reveal Unseen Relationships in Medieval Scotland","9","",""
"2139","15","Validating Computational Stylistics in Literary Interpretation","10","",""
"2140","15","Visualization As a Bridge to Close Reading: The Audience in The Castle of Perseverance","2","",""
"2141","15","Visualization of Historical Knowledge Structures: An Analysis of the Bibliography of Philosophy","2","",""
"2142","15","Visualization, Interactivity and Contextualization as Digital Cultural Empowerment: Ancient Egyptian Architectural Terminology Online","2","",""
"2143","15","Visualizing Computational, Transversal Narratives from the World Trade Towers","10","",""
"2144","15","Visualizing Global News","10","",""
"2145","15","Visualizing Homelessness","2","",""
"2146","15","Visualizing theatrical heritage: Computer modelling as a tool for researching the theatre history of the Low Countries","2","",""
"2147","15","What is Modeling and What is Not?","3","",""
"2148","15","What remains to be done - Exposing invisible collections in the other 6500 languages and why it is a DH enterprise.","9","",""
"2149","15","What we make of Code: The Role of Programming in the Digital Humanities","2","",""
"2150","15","What's in a Discipline? Research Practices, Use of Tools and Content in the Humanities and Social Sciences - The web-based questionnaires of EHRI and Europeana Cloud.","2","",""
"2151","15","When Kidnapping is but One Risk: Digital Studies Challenge Scholarly and Regional Cultures","10","",""
"2152","15","Where is my Other Half?","10","",""
"2153","15","Who is we? The social media project: Día de las humanidades digitales/Dia das humanidades digitais","9","",""
"2154","15","XML-Print. Typesetting arbitrary XML documents in high quality","10","",""
"2155","15","Z-Axis Scholarship: Modeling How Modernists Wrote the City","10","",""
"2156","16","'""Everything on Paper Will Be Used Against Me"": Quantifying Kissinger'","10","https://github.com/ADHO/dh2015/blob/master/xml/KAUFMAN_Micki___Everything_on_Paper_Will_Be_Used_Agains.xml",""
"2157","16","_CATview_ - Supporting The Investigation Of Text Genesis Of Large Manuscripts By An Overall Interactive Visualization Tool","2","https://github.com/ADHO/dh2015/blob/master/xml/P_CKELMANN_Marcus__CATview____Supporting_The_Investigat.xml",""
"2158","16","‘Nothing That Is Not There and The Nothing That Is’: Tracking the Digital Echoes between Churchyard and Theatre in Shakespeare’s London","10","https://github.com/ADHO/dh2015/blob/master/xml/DABBS_Thomas_Winn__Nothing_That_Is_Not_There_and_The_No.xml",""
"2159","16","“…a writer essential to the others…” ∗: further reflections towards a methodology and case study of a potential exemplar of Shakespeare’s hand in annotations to an edition of the Eirenarcha (c1605?)","3","https://github.com/ADHO/dh2015/blob/master/xml/COHEN_Hart___a_writer_essential_to_the_others______furt.xml",""
"2160","16","'88milSMS', A New Digital Corpus Resource Of French Text Messages: Why We Chose To Exclude Full Transcoding And Standardised Tagging.","2","https://github.com/ADHO/dh2015/blob/master/xml/PANCKHURST_Rachel__88milSMS___A_New_Digital_Corpus_Reso.xml",""
"2161","16","A 3D Model Of The Venetian Galeazza","2","https://github.com/ADHO/dh2015/blob/master/xml/CAVINATO_Alessandro_A_3D_Model_Of_The_Venetian_Galeazza.xml",""
"2162","16","A Closer Look: Developing Mobile Applications to Reveal Hidden Meanings of Art","2","https://github.com/ADHO/dh2015/blob/master/xml/DOWNING_Laura_Kathryn_A_Closer_Look__Developing_Mobile_.xml",""
"2163","16","A Collaborative Interdisciplinary Knowledge-Base for the Art Conservation Community","9","https://github.com/ADHO/dh2015/blob/master/xml/HUNTER_Jane_A_Collaborative_Interdisciplinary_Knowledge.xml",""
"2164","16","A Computational Bibliography Of Two Plays From The Shakespeare Folio","10","https://github.com/ADHO/dh2015/blob/master/xml/CRAIG_Hugh_A_Computational_Bibliography_Of_Two_Plays_Fr.xml",""
"2165","16","A Digital Humanities GIS Ontology: Tweetflickertubing James Joyce's ""Ulysses"" (1922)","10","https://github.com/ADHO/dh2015/blob/master/xml/TRAVIS_Charles_Bartlett_A_Digital_Humanities_GIS_Ontolo.xml",""
"2166","16","A Distant Reading Visualization for Variant Graphs","10","https://github.com/ADHO/dh2015/blob/master/xml/J_NICKE_Stefan_A_Distant_Reading_Visualization_for_Vari.xml",""
"2167","16","A Longitudinal Analysis of Knowledge Integration in Digital Humanities Using Co-citation Analysis","9","https://github.com/ADHO/dh2015/blob/master/xml/TANG_Muh_Chyun_A_Longitudinal_Analysis_of_Knowledge_Int.xml",""
"2168","16","A plea for a method-driven agenda in the Digital Humanities","10","https://github.com/ADHO/dh2015/blob/master/xml/KUHN_Jonas_A_plea_for_a_method_driven_agenda_in_the_Dig.xml",""
"2169","16","A Quantitative Analysis for the Authorship of Saikaku's Posthumous Works Compared with Dansui's works","2","https://github.com/ADHO/dh2015/blob/master/xml/UESAKA_Ayaka_A_Quantitative_Analysis_for_the_Authorship.xml",""
"2170","16","A Story of Design Research: Initiating a change network for Western Sydney","2","https://github.com/ADHO/dh2015/blob/master/xml/GILL_Alison_A_Story_of_Design_Research__Initiating_a_ch.xml",""
"2171","16","A Study of Symbolic Element Network in National Emblems","2","https://github.com/ADHO/dh2015/blob/master/xml/LIU_Jyi_Shane_A_Study_of_Symbolic_Element_Network_in_Na.xml",""
"2172","16","A System for the Textual Inheritance Relation of Chinese Historical Classics ""Comprehensive Mirror"", ""Grand Tortoise"" and ""Standard Histories""","2","https://github.com/ADHO/dh2015/blob/master/xml/HSIANG_Jieh_A_System_for_the_Textual_Inheritance_Relati.xml",""
"2173","16","Accidental Discovery, Intentional Inquiry: Leveraging Linked Data to Uncover the Women of Jazz","9","https://github.com/ADHO/dh2015/blob/master/xml/PATTUELLI_M__Cristina_Accidental_Discovery__Intentional.xml",""
"2174","16","Alveo: Software Engineering with Humanities Researchers","2","https://github.com/ADHO/dh2015/blob/master/xml/BERGHOLD_Jared_Alveo__Software_Engineering_with_Humanit.xml",""
"2175","16","An Efficient Collaborative Web-based Working Environment For The Creation Of A Digital Sanskrit Dictionary","10","https://github.com/ADHO/dh2015/blob/master/xml/HESSE_Sascha_An_Efficient_Collaborative_Web_based_Worki.xml",""
"2176","16","An entity-based approach to interoperability in the Canadian Writing Research Collaboratory","10","https://github.com/ADHO/dh2015/blob/master/xml/BROWN_Susan_An_entity_based_approach_to_interoperabilit.xml",""
"2177","16","An Environment for putting Digital Humanities Pedagogy in Place","2","https://github.com/ADHO/dh2015/blob/master/xml/BURR_Elisabeth_An_Environment_for_putting_Digital_Human.xml",""
"2178","16","Anatomy of a Drop-Off Reading Curve","9","https://github.com/ADHO/dh2015/blob/master/xml/BORNET_Cyril_Anatomy_of_a_Drop_Off_Reading_Curve.xml",""
"2179","16","Animation of Chinese Characters: the Evolution of the Shapes and Styles","2","https://github.com/ADHO/dh2015/blob/master/xml/HU_Jiajia_Animation_of_Chinese_Characters__the_Evolutio.xml",""
"2180","16","Applying a Combined Quantitative and Qualitative Analysis Method to Evaluate the Translatorship of the Fourth Division of the Chinese Translation of the Dīrgha-āgama","10","https://github.com/ADHO/dh2015/blob/master/xml/HUNG_Jen_Jou_Applying_a_Combined_Quantitative_and_Quali.xml",""
"2181","16","Approaching Textuality with the Metaphor of the Digitized Workset","9","https://github.com/ADHO/dh2015/blob/master/xml/BHATTACHARYYA_Sayan_Approaching_Textuality_with_the_Met.xml",""
"2182","16","Archaeology in the Digital Age: From Paper to Databases","2","https://github.com/ADHO/dh2015/blob/master/xml/POIBEAU_Thierry_Archaeology_in_the_Digital_Age__From_Pa.xml",""
"2183","16","At the Crossroads of Data and Wonder: Algorithmic Approaches to Fairy Tales on Television","9","https://github.com/ADHO/dh2015/blob/master/xml/MCDONALD_Jarom_Lyle_At_the_Crossroads_of_Data_and_Wonde.xml",""
"2184","16","Automated Comparison of Narrative and Character Function Similarity Using Graph Theory","10","https://github.com/ADHO/dh2015/blob/master/xml/MILLER_Ben_Automated_Comparison_of_Narrative_and_Charac.xml",""
"2185","16","Automatic semantic tagging of Leo Tolstoys works","9","",""
"2186","16","AXES: Researching & Accessing Videos Through Multimodal Analyses","2","https://github.com/ADHO/dh2015/blob/master/xml/KLEPPE_Martijn_AXES__Researching___Accessing_Videos_Thr.xml",""
"2187","16","Beyond Boundaries: Digital Humanities, Life Sciences and IT research","10","https://github.com/ADHO/dh2015/blob/master/xml/CLIVAZ_Claire_Beyond_Boundaries__Digital_Humanities__Li.xml",""
"2188","16","Beyond Potomology And Place - (Re) Imagining Narratives Of Journeys And Non-Places Along The Oxus River","10","",""
"2189","16","Beyond Pragmatics: Disciplinary Profits of Interdisciplinary Approaches","9","https://github.com/ADHO/dh2015/blob/master/xml/JACKE_Janina_Beyond_Pragmatics__Disciplinary_Profits_of.xml",""
"2190","16","Beyond the Library Walls: The National Library of Wales Research Programme in Digital Collections","10","https://github.com/ADHO/dh2015/blob/master/xml/JAMES_Rhian_Beyond_the_Library_Walls__The_National_Libr.xml",""
"2191","16","Black Boxed Selves","3","https://github.com/ADHO/dh2015/blob/master/xml/GALLAGHER_Rob_Black_Boxed_Selves.xml",""
"2192","16","Bridging the Gap between the National Library and the Researchers","2","https://github.com/ADHO/dh2015/blob/master/xml/WILMS_Lotte_Bridging_the_Gap_between_the_National_Libra.xml",""
"2193","16","Bringing to life the Living Archive of Aboriginal Languages","9","https://github.com/ADHO/dh2015/blob/master/xml/BOW_Cathy_Bringing_to_life_the_Living_Archive_of_Aborig.xml",""
"2194","16","Building Better Linked Data & Ontology Visualization Tools","2","https://github.com/ADHO/dh2015/blob/master/xml/SIMPSON_John_Edward_Building_Better_Linked_Data___Ontol.xml",""
"2195","16","Building Post-disaster Social Capital: A Current State Report on the UC CEISMIC Digital Archive","10","https://github.com/ADHO/dh2015/blob/master/xml/SMITHIES_James_Dakin_Building_Post_disaster_Social_Capi.xml",""
"2196","16","Building The Early Modern Digital University: Using Social Network Analysis and Digital Visualization Tools To Bring The Early Modern Network Of Networks (EMNON) To Life","9","https://github.com/ADHO/dh2015/blob/master/xml/WILSON_Emma_Annette_Building_The_Early_Modern_Digital_U.xml",""
"2197","16","Can A Global Digital Humanities Include Private-Sector Collaborations? A Case Study Of One University-Community Digital Humanities Partnership","10","",""
"2198","16","Capturing Virtual Verse: A Needs Assessment for Access and Preservation of Online-Only Literature","10","https://github.com/ADHO/dh2015/blob/master/xml/GREEN_Harriett_Elizabeth_Capturing_Virtual_Verse__A_Nee.xml",""
"2199","16","Challenges of an XML-based Open-Access Journal: Digital Humanities Quarterly","10","https://github.com/ADHO/dh2015/blob/master/xml/FLANDERS_Julia_Challenges_of_an_XML_based_Open_Access_J.xml",""
"2200","16","Change, transition and governance: Lessons from a long-term, large scale DH collaboration","9","",""
"2201","16","Character Network Analysis of Émile Zola's Les Rougon-Macquart","10","https://github.com/ADHO/dh2015/blob/master/xml/ROCHAT_Yannick_Character_Network_Analysis_of__mile_Zola.xml",""
"2202","16","Collaborative Digitisation: UCL's Medieval Manuscript Fragment Project","9","https://github.com/ADHO/dh2015/blob/master/xml/TERRAS_Melissa_Collaborative_Digitisation__UCL_s_Mediev.xml",""
"2203","16","Collaborative, Speculative Technologically-Enhanced Mobile Libraries, Or How Davidson College Students Learned to Stop Worrying and Love The Library","2","https://github.com/ADHO/dh2015/blob/master/xml/CHRISTIAN_LAMB_Caitlin_Collaborative__Speculative_Techn.xml",""
"2204","16","Computational approaches to Ireland's Contemporary Literary Journals","10","https://github.com/ADHO/dh2015/blob/master/xml/O_SULLIVAN_James_Christopher_Computational_approaches_t.xml",""
"2205","16","Computer Simulation of Diffusion: New Suggestions about the Process of Language Change","10","https://github.com/ADHO/dh2015/blob/master/xml/KRETZSCHMAR_William_Computer_Simulation_of_Diffusion__N.xml",""
"2206","16","Concepts Through Time: Tracing Concepts In Dutch Newspapers Discourse (1890-1990) Using Word Embeddings","10","https://github.com/ADHO/dh2015/blob/master/xml/WEVERS_Melvin_Concepts_Through_Time__Tracing_Concepts_I.xml",""
"2207","16","Conceptualizing DH for Multiple Audiences: Folkvine and Chinavine","9","https://github.com/ADHO/dh2015/blob/master/xml/JANZ_Bruce_Conceptualizing_DH_for_Multiple_Audiences__F.xml",""
"2208","16","Construction of the Corpus of Toraakira-bon Kyōgen","2","https://github.com/ADHO/dh2015/blob/master/xml/ICHIMURA_Taro_Construction_of_the_Corpus_of_Toraakira_b.xml",""
"2209","16","Contextual Modelling in Digital Humanities","10","https://github.com/ADHO/dh2015/blob/master/xml/EIDE__yvind_Contextual_Modelling_in_Digital_Humanities.xml",""
"2210","16","Cora Crane's Contribution to Stephen Crane's Posthumous Fiction","9","https://github.com/ADHO/dh2015/blob/master/xml/HOOVER_David_L__Cora_Crane_s_Contribution_to_Stephen_Cr.xml",""
"2211","16","Creating Linked Data within Archival Description: Tools for Extracting, Validating, and Encoding Access Points for Finding Aids","2","https://github.com/ADHO/dh2015/blob/master/xml/GRACY_Karen_F__Creating_Linked_Data_within_Archival_Des.xml",""
"2212","16","Creating Time Capsules for Colonial Botanical Drugs in the Early Modern Low Countries","9","https://github.com/ADHO/dh2015/blob/master/xml/ZERVANOU_Kalliopi_Creating_Time_Capsules_for_Colonial_B.xml",""
"2213","16","Crowdsourcing the Text: Contemporary Approaches to Participatory Resource Creation","3","https://github.com/ADHO/dh2015/blob/master/xml/POWELL_Daniel_James_Crowdsourcing_the_Text__Contemporar.xml",""
"2214","16","DARIAH-DE: Building a Distributed Research Data Repository for a Digital Humanities Network","2","https://github.com/ADHO/dh2015/blob/master/xml/SCHMUNK_Stefan_DARIAH_DE__Building_a_Distributed_Resear.xml",""
"2215","16","Data Aesthetics, Old and New.","9","https://github.com/ADHO/dh2015/blob/master/xml/LEMOS_MORAIS_Renata_Data_Aesthetics__Old_and_New_.xml",""
"2216","16","Data Revisualization as Critical Humanities Practice: Reinterpreting 19th Century Data with Modern Tools","10","https://github.com/ADHO/dh2015/blob/master/xml/SCHMIDT_Benjamin_Data_Revisualization_as_Critical_Human.xml",""
"2217","16","Detection of People Relationship Using Topic Model from Diaries in Medieval Period of Japan","2","https://github.com/ADHO/dh2015/blob/master/xml/YAMADA_Taizo_Detection_of_People_Relationship_Using_Top.xml",""
"2218","16","Developing a Sustainable Model in Mutual Cultural Digital Heritage","9","https://github.com/ADHO/dh2015/blob/master/xml/PETERS_Nonja_Ivonne_Developing_a_Sustainable_Model_in_M.xml",""
"2219","16","DH and the Pervasive a priori","10","https://github.com/ADHO/dh2015/blob/master/xml/SEBERGER_John_How_Long_Is_Now__The__Digital__in_DH.xml",""
"2220","16","Digital Corpus and Toolset for Performing Text Analysis on Chinese Translation of Buddhist Scriptures","2","https://github.com/ADHO/dh2015/blob/master/xml/HUNG_Jen_Jou_Digital_Corpus_and_Toolset_for_Performing_.xml",""
"2221","16","Digital Democracy Project: Making Government More Transparent one Video at a Time","2","https://github.com/ADHO/dh2015/blob/master/xml/DEKHTYAR_Alex_Digital_Democracy_Project__Making_Governm.xml",""
"2222","16","Digital Dunhuang: Enhancing Virtual Explorations of the Real Dunhuang","3","https://github.com/ADHO/dh2015/blob/master/xml/DOWNIE_J__Stephen_Digital_Dunhuang__Enhancing_Virtual_E.xml",""
"2223","16","Digital Evidence in the Jury Room: the Impact of Tablets on Communication and Decision","9","https://github.com/ADHO/dh2015/blob/master/xml/TAIT_David_Digital_Evidence_in_the_Jury_Room__the_Impac.xml",""
"2224","16","Digital Humanities as Catalyst for Digital Art History: The Slade Archive Project","9","https://github.com/ADHO/dh2015/blob/master/xml/TERRAS_Melissa_Digital_Humanities_as_Catalyst_for_Digit.xml",""
"2225","16","Digital Humanities educational vehicle - new patterns of research and learning approach in the Digital Age of Access","10","https://github.com/ADHO/dh2015/blob/master/xml/DURIDANOV_Ludmil_Digital_Humanities_educational_vehicle.xml",""
"2226","16","Digital Media Literacy in Indonesian Youth: Building Sustainable Democratic Institutions and Practices","2","https://github.com/ADHO/dh2015/blob/master/xml/SUWANA_Fiona_Digital_Media_Literacy_in_Indonesian_Youth.xml",""
"2227","16","Digital Musical Industry and Identity in Melanesia","3","https://github.com/ADHO/dh2015/blob/master/xml/WEBB_GANNON_Camellia_Bell_Digital_Musical_Industry_and_.xml",""
"2228","16","Digital Network Analysis of Dramatic Texts","10","https://github.com/ADHO/dh2015/blob/master/xml/FISCHER_Frank_Digital_Network_Analysis_of_Dramatic_Text.xml",""
"2229","16","Digitalization of Shoso-in Monjo and Extraction of Knowledge","9","https://github.com/ADHO/dh2015/blob/master/xml/GOTO_Makoto_Digitalization_of_Shoso_in_Monjo_and_Extrac.xml",""
"2230","16","Digitisation and Automatic Classification of Indian Folktales through MAIF","9","",""
"2231","16","Digitisation, Processing, Dissemination: Charting the Ecology of the New Scholarly Edition","2","https://github.com/ADHO/dh2015/blob/master/xml/MARTINEZ_Merisa_Ariel_Digitisation__Processing__Dissemi.xml",""
"2232","16","Digitizing Slow and Deliberate: The Victorian Short Fiction Project","9","https://github.com/ADHO/dh2015/blob/master/xml/BROWNE_Jeremy_Digitizing_Slow_and_Deliberate__The_Victo.xml",""
"2233","16","Disciplinary Impact: The Effect of Digital Editing","10","https://github.com/ADHO/dh2015/blob/master/xml/PIERAZZO_Elena_Disciplinary_Impact__The_Effect_of_Digit.xml",""
"2234","16","Discourse, Design and Disorder: Digital Models for an Aesthetic Literary Theory","10","https://github.com/ADHO/dh2015/blob/master/xml/ALGEE_HEWITT_Mark_Andrew_Discourse__Design_and_Disorder.xml",""
"2235","16","Discovering and Rediscovering Full Text: Unearthing and Refactoring","9","https://github.com/ADHO/dh2015/blob/master/xml/KILNER_Kerry_Discovering_and_Rediscovering_Full_Text__U.xml",""
"2236","16","DIVADIAWI - A Web-based Interface for Semi-automatic Labeling of Historical Document Images","10","https://github.com/ADHO/dh2015/blob/master/xml/WEI_Hao_DIVADIAWI___A_Web_based_Interface_for_Semi_auto.xml",""
"2237","16","DIVAServices - A RESTful Web Service for Document Image Analysis Methods","9","https://github.com/ADHO/dh2015/blob/master/xml/W_RSCH_Marcel_DIVAServices___A_RESTful_Web_Service_for_.xml",""
