"id","conference","title","work_type","url","parent_session"
"8039","25","MILE: A Markup Language for Interactive Drill Courseware","1","https://web.archive.org/web/20030119032419/http://www.cs.queensu.ca/achallc97/papers/p038.html",""
"8040","25","Authorship attribution - the case of lexical innovations","1","https://web.archive.org/web/20010221083843/http://www.cs.queensu.ca/achallc97/papers/p006.html",""
"8041","25","Multi-Authorship of the Scriptores Historiae Augustae: How the Use of Subsets Can Win or Lose the Case.","1","https://web.archive.org/web/20001013091805/http://www.cs.queensu.ca/achallc97/papers/p007.html",""
"8042","25","Institutional Support in the Advancement of Technology in the Humanities: Roles, Models, and Collaboration","1","https://web.archive.org/web/20020713215653/http://www.cs.queensu.ca/achallc97/papers/s011.html",""
"8043","25","The Epistemology of the Electronic Text: Scholarly and Pedagogical Considerations","23","https://web.archive.org/web/20020713220121/http://www.cs.queensu.ca/achallc97/papers/s002.html",""
"8044","25","Root, trunk, and branch: institutional and infrastructural models for humanities computing in the U.K.","23","https://web.archive.org/web/20030313062751/http://www.cs.queensu.ca/achallc97/papers/s009.html",""
"8045","25","Individual statements (in the order of presentation)","1","https://web.archive.org/web/20030313062751/http://www.cs.queensu.ca/achallc97/papers/s009.html","8044"
"8046","25","Theories of Meaning and the Electronic Text / Théories du sens et les textes électroniques","23","https://web.archive.org/web/20001030152328/http://www.cs.queensu.ca/achallc97/papers/s006.html",""
"8047","25","""A worlde of wordes"": Conceptions of Textual Organisation in the Electronic Medium, or, The Dynamic Text as Hypertext","1","https://web.archive.org/web/20001030152328/http://www.cs.queensu.ca/achallc97/papers/s006.html","8046"
"8048","25","Le drôle d'oiseau de Flaubert: la problématique du perroquet dans la base de données ARTFL","1","https://web.archive.org/web/20001030152328/http://www.cs.queensu.ca/achallc97/papers/s006.html","8046"
"8049","25","Révolution textuelle","1","https://web.archive.org/web/20001030152328/http://www.cs.queensu.ca/achallc97/papers/s006.html",""
"8050","25","Labour Issues in Humanities Computing","23","https://web.archive.org/web/20020713220031/http://www.cs.queensu.ca/achallc97/papers/s001.html",""
"8051","25","Managing Labor and Managing Management in a Distributed Online Humanities Project: The H-Net Experience","1","https://web.archive.org/web/20020713220031/http://www.cs.queensu.ca/achallc97/papers/s001.html","8050"
"8052","25","E-Text Creation as Cottage Industry: The Victorian Women Writers Project","1","https://web.archive.org/web/20020713220031/http://www.cs.queensu.ca/achallc97/papers/s001.html","7111"
"8053","25","Discipline-Specific Humanities Computing: Whose Job Is It?","1","https://web.archive.org/web/20020713220031/http://www.cs.queensu.ca/achallc97/papers/s001.html",""
"8054","25","The Orlando Project: Humanities Computing in Conversation with Literary History","1","https://web.archive.org/web/20020713214554/http://www.cs.queensu.ca/achallc97/papers/s005.html",""
"8055","25","Mapping from objects to markup: a springboard for multiple-strategy electronic publishing","1","https://web.archive.org/web/20020713215049/http://www.cs.queensu.ca/achallc97/papers/p030.html",""
"8056","25","In Defense of Invalid SGML","1","https://web.archive.org/web/20020713214501/http://www.cs.queensu.ca/achallc97/papers/p041.html",""
"8057","25","Codage des références et coréférences dans les DHM","1","https://web.archive.org/web/20030313061030/http://www.cs.queensu.ca/achallc97/papers/p031.html",""
"8058","25","Electronic Theses and Dissertations in the Humanities","1","https://web.archive.org/web/20020713220657/http://www.cs.queensu.ca/achallc97/papers/p037.html",""
"8059","25","The Electronic Archive of Early American Fiction (1775-1850)","1","https://web.archive.org/web/20020713214958/http://www.cs.queensu.ca/achallc97/papers/p039.html",""
"8060","25","Applying the TEI: Problems in the classification of proper nouns","23","https://web.archive.org/web/20020713215142/http://www.cs.queensu.ca/achallc97/papers/s007.html",""
"8061","25","Nouns Proper and Improper: Using the TEI for primary sources","1","https://web.archive.org/web/20020713215142/http://www.cs.queensu.ca/achallc97/papers/s007.html",""
"8062","25","Compound Unit Recognition for Efficient English-Korean Translation","1","https://web.archive.org/web/20021017212438/http://www.cs.queensu.ca/achallc97/papers/p012.html",""
"8063","25","Korean Analysis and Transfer in Multilingual Machine Translation System","1","https://web.archive.org/web/20020713220521/http://www.cs.queensu.ca/achallc97/papers/p024.html",""
"8064","44","Social Engagement in the Digital Humanities: An Intervention in Electronic Scholarly Editions and E-Journals","8","",""
"8065","44","Statistical text-mining on English Woman’s Journal","3","",""
"8066","44","Constructing a Platform for Situated Learning of Japanese Traditional Culture in the 3D Metaverse","1","",""
"8067","44","Accessing Multiple Japanese Humanities Databases Using English Queries","1","",""
"8068","44","A case study in Nikko: For the better access of quality information on sites of World Heritage by enhancement of AR Technology","1","",""
"8069","44","Digitizing the Hōbōgirin Following the Mark-up Guidelines of TEI: Potentialities and Problems","1","",""
"8070","44","Multiple-policy character annotation based on CHISE","1","",""
"8071","44","Buddhist Philology in the Age of Digital Humanities: Retro- and Prospect","1","",""
"8072","44","What Digital Humanities Means for Victorian Studies","1","",""
"8073","44","A Curriculum for An Interdisciplinary Program in Digital Humanities","1","",""
"8074","44","An Interdisciplinary Digital Humanities Project on Canadian Health Information Design","1","",""
"8075","44","The Future of Digital Humanities - Tools and Visualization","8","",""
"8076","44","Report on Developing a Digital Glossary of Buddhist Terminology by using TEI-P5","2","",""
"8077","44","Graph Representation of the Connotations of Classical Japanese Poetic Vocabulary","2","",""
"8078","44","A computational stylistic analysis of popular songs made by Japanese female singer-songwriters using kernel PCA and random forests","2","",""
"8079","44","A Bibliographic Search System with a Focus on the User’s Knowledge Structure","2","",""
"8080","44","Revealing Japanese Modern History of Philosophy using Natural Language Processing and Visualization","2","",""
"8081","44","Quantitative Analysis of Loanwords of Eight Literary Works in the Heian Period (794-1185)","2","",""
"8082","44","Multi-language parallel corpora and XML annotation tools","2","",""
"8083","44","From black magic to Henrik Ibsen - or Digitizing culture: books, images and manuscripts","8","",""
"8084","44","Digital Humanities for Japanese Arts and Cultures","3","",""
"8085","44","Research Tools for the Taiwan History Digital Library","3","",""
"8086","44","Poetry as a game – An Analysis of Online New Poetry Games","1","",""
"8087","44","Features of authors of Noh drama from mathematical analyses of words and phrases","1","",""
"8088","44","Special session: CATMA follow-up session","1","",""
"8089","44","Overview and Tasks of Databases at the National Institute of Japanese","1","",""
"8090","44","Scaling Digital Humanities on (and utilising) the Web","1","",""
"8091","44","Large-Scale Music Audio Analyses Using High Performance Computing Technologies: Creating New Tools, Posing New Questions","1","",""
"8092","44","Toward a Syntactic Analysis of Classical Chinese Texts","1","",""
"8093","44","Toward Syntactic Frame Retrieval of Classical Chinese Rhymes using Japanese 'kun' readings and Syntactic parallelism of couplets","1","",""
"8094","44","A Prototype of a Classical Chinese Morphological Analyzer based on MeCab","1","",""
"8095","44","Implementing Rhetorical Structure Database System for Digital Archive","1","",""
"8096","44","Text Representation and Collaboration -- Reclaiming the Electronic Text as a Base for Research","1","",""
"8097","44","A Support Method for Text Structuring of Japanese Historical Documents","1","",""
"8098","43","Predicting Prose that Sells: Analyzing Bestseller Prediction Models","1","https://eadh2018.exordo.com/programme/presentation/10",""
"8099","43","Sentiment Analysis Across Three Centuries of the English Novel: Towards Negative or Positive Emotions?","1","https://eadh2018.exordo.com/files/papers/81/final_draft/Rybicki_Sentiments.pdf",""
"8100","43","Digital analysis of emotions in the Grimms' fairy tales","1","https://eadh2018.exordo.com/files/papers/138/final_draft/EADH-GR-Digital-analysis-of-emotions-in-the-brothers_Grimms-fairy-tales.pdf",""
"8101","43","Sentiment ontologies, lexica and subjects of emotions in transhistoric text mining of political reports","1","https://eadh2018.exordo.com/programme/presentation/13",""
"8102","43","Graph Models for Textual Data: Between Text and Information","1","https://eadh2018.exordo.com/programme/presentation/31",""
"8103","43","Socializing and Visualizing Literary Processes in a Digital Simulator","1","https://eadh2018eadh.files.wordpress.com/2018/12/eadh2018_programme_5dec1.pdf",""
"8104","43","SPEEDy – a dynamic Standoff PropErty EDitor","1","https://eadh2018.exordo.com/files/papers/131/final_draft/SPEEDy-Neill-Kuczera.pdf",""
"8105","43","Computational (HTR, NLP and Computer vision) and digital means for the creation of an interactive eXist based website for critical editions: the eRabbinica Mishnah website","1","https://eadh2018.exordo.com/programme/presentation/16",""
"8106","43","Erkenntnisgewinn durch die individuelle Erfahrbarkeit von Daten und Information in interaktiven virtuellen Welten - Annotierte Bühnenmodelle in VR","1","https://eadh2018.exordo.com/files/papers/160/final_draft/EADH2018_long-paper_schubert-wieners-eide.pdf",""
"8107","43","Extramural Digital Humanities: Sir Hans Sloane's catalogues of his collections","1","https://eadh2018.exordo.com/files/papers/82/final_draft/Final_abstract_EADH_18.pdf",""
"8108","43","Partners or servants? The role of libraries in digital humanities and data management","1","https://eadh2018.exordo.com/files/papers/85/final_draft/EADH_final_abstract_John_Cox.pdf",""
"8109","43","Re-usable, Relevant, Reliable and Resilient: The R4 to Identify the New Digital Cultural Heritage","1","https://eadh2018.exordo.com/files/papers/102/final_draft/Paper_Barbuti_EADH_2018_def.pdf",""
"8110","43","Letters 1916-1923: Remembrance and Redesign","1","https://eadh2018.exordo.com/programme/presentation/21",""
"8111","43","A Model to Increase the Visibility and Usage of Cultural Heritage Objects: UNESCO’s Memory of the World List As a Humanities Data","1","https://eadh2018.exordo.com/programme/presentation/22",""
"8112","43","Data heritage in museums","1","https://eadh2018.exordo.com/files/papers/166/final_draft/eadh-final-CZ.pdf",""
"8113","43","Bridging the Gap between Plato and His Successors: Towards an Annotated Gold Standard of Intertextual References to Plato in Ancient Greek Literature","1","https://eadh2018.exordo.com/files/papers/49/final_draft/Poeckelmann_Woeckener-Gade_Bridging_the_gap.pdf",""
"8114","43","After transcription and before collation: Case studies of the projects “The Chronicle of Matthew of Edessa Online” and “ A digital critical edition of Ałvesagirk‛”","1","https://eadh2018.exordo.com/files/papers/155/final_draft/After_Transcription_and_Before_Collation.pdf",""
"8115","43","A Comparison of Traditional and Digital Methods for Stemmatic Analysis of the Chronicle of Matthew of Edessa","1","https://eadh2018.exordo.com/files/papers/152/final_draft/A_Comparison_of_Traditional_and_Digital_Methods_for_Stemmatic_Analysis_-_final_abstract.pdf",""
"8116","43","Euporia: annotating “a passo di gambero”","1","https://eadh2018.exordo.com/files/papers/156/final_draft/FINAL_eadh2018_long_paper_on_euporia.pdf",""
"8117","43","Projektvorstellung: Interaktionale Sprache bei Andreas Gryphius – datenbankbasiertes Arbeiten zum Dramenwerk aus linguistischliteraturwissenschaftlicher Perspektive","1","https://eadh2018.exordo.com/files/papers/111/final_draft/paper_eadh_gryphius_final.pdf",""
"8118","43","Partikeln im Dramenwerk von Andreas Gryphius – eine interaktionale Perspektive","1","https://eadh2018.exordo.com/files/papers/107/final_draft/Abstract_EADH_FIN.pdf",""
"8119","43","Digital Ricoeur Data Model","1","https://eadh2018.exordo.com/files/papers/70/final_draft/eadh2018-ricoeur-data-model-abstract.pdf",""
"8120","43","Reading Data: On Digital Reception Studies","1","https://eadh2018.exordo.com/files/papers/83/final_draft/Reading_Data__On_Digital_Reception_Studies.pdf",""
"8121","43","Data Modeling in Legal History","1","https://eadh2018.exordo.com/files/papers/106/final_draft/Abstract.pdf",""
"8122","43","Alternative Database Structures for Prosopographical Research","1","https://eadh2018.exordo.com/files/papers/136/final_draft/Abstract_Final.pdf",""
"8123","43","Working at the margins: challenges, networks and infrastructures for Greek research data and digital humanities","1","https://eadh2018.exordo.com/files/papers/100/final_draft/Working_at_the_margins_EADH2018.pdf",""
"8124","43","De la donnée à ses artefacts : processus, méthode et formalisation dans une recherche exploratoire","1","https://eadh2018.exordo.com/programme/presentation/33",""
"8125","43","ADVISORY SESSION on DH and the ERC","3","https://eadh2018eadh.files.wordpress.com/2018/12/eadh2018_programme_5dec1.pdf",""
"8126","43","PLENARY ROUNDTABLE: Data in Digital Humanities","8","https://eadh2018eadh.files.wordpress.com/2018/12/eadh2018_programme_5dec1.pdf",""
"8127","43","Building a Latin Metaphor Dictionary","1","https://eadh2018.exordo.com/programme/presentation/34",""
"8128","43","The Regesta Imperii as a Graph","1","https://eadh2018.exordo.com/files/papers/48/final_draft/RI-as-a-Graph-Kuczera.pdf",""
"8129","43","A Knowledge Graph from the Regesta Imperii: Construction, Visualization and Macro-level Analyses","1","https://eadh2018.exordo.com/files/papers/130/final_draft/visualizing-regesta-imperii.pdf",""
"8130","43","What comes next? Finding connections between word embeddings","1","https://eadh2018.exordo.com/files/papers/56/final_draft/2018-12-04_EADH_LASSNER_BRANDL.pdf",""
"8131","43","Adressbuch der Geschichte. Named-entity recognition und Normdatenanreicherung für archivische Verzeichnungseinheiten","1","https://eadh2018.exordo.com/files/papers/87/final_draft/2018-12-08_Aumann_Sandner_Adressbuch_der_Geschichte.pdf",""
"8132","43","Tool Criticism on emotional text analysis","1","https://eadh2018.exordo.com/programme/presentation/102",""
"8133","43","Visual Exploration of Musicians and Institutions","1","https://eadh2018.exordo.com/programme/presentation/39",""
"8134","43","Interactive Visual Exploration of Engineers' Biographies","1","https://eadh2018.exordo.com/files/papers/54/final_draft/Interactive_Visual_Exploration_of_Engineers_Biographies.pdf",""
"8135","43","The canon of Dutch literature according to Wikipedia: A network analysis of 2286 Wikipedia-entries on Dutch authors","1","https://eadh2018.exordo.com/files/papers/104/final_draft/Abstract_Long_Paper_EADH_2018_Van_der_Deijl___Smeets_final_version.pdf",""
"8136","43","Versionskontrollsysteme als Grundlage für einen kollaborativen wissenschaftlichen Diskurs","1","https://eadh2018.exordo.com/files/papers/33/final_draft/Versionskontrollsysteme_final.pdf",""
"8137","43","Sechs Wege der Modellierung von Textverknüpfungen mit Linked Open Data","1","https://eadh2018.exordo.com/files/papers/105/final_draft/Sechs_Wege_der_Modellierung_von_Textverknu_pfungen_mit_Linked_Open_Data.pdf",""
"8138","43","Conceptual Integration of Archives, Data, Information and Information Technology for Digital Memory Applications: The CMDMA Model","1","https://eadh2018.exordo.com/programme/presentation/44",""
"8139","43","Raw and Dirty: A case study on data curation for literary research","1","https://eadh2018.exordo.com/files/papers/27/final_draft/Benatti_King_EADH_final.pdf",""
"8140","43","Towards Tool Criticism: Complementing Manual with Computational Literary Analyses","1","https://eadh2018.exordo.com/files/papers/89/final_draft/ToolCriticism_MJ.pdf",""
"8141","43","Word Deaths: Oxford English Dictionary as Historical Data","1","https://eadh2018.exordo.com/programme/presentation/47",""
"8142","43","Poetry in Motion: quantified self data and automated poetry generation","1","https://eadh2018.exordo.com/files/papers/117/final_draft/EverVerse_EADH2018_proposal.pdf",""
"8143","43","Exploratory Data Analysis for Poetry","1","https://eadh2018.exordo.com/programme/presentation/49",""
"8144","43","Characterization of literary styles by the automatic extraction of the reported speeches in the novels of Victor Hugo","1","https://eadh2018.exordo.com/programme/presentation/50",""
"8145","43","Engaging with the diversity of data: knowledge sources in the Dictionnaire Universel","1","https://eadh2018.exordo.com/programme/presentation/51",""
"8146","43","Capta versus data: historical heuristics, criticism and interpretation in the digital age","1","https://eadh2018.exordo.com/files/papers/94/final_draft/Volodin_EADH-2018.pdf",""
"8147","43","Research Communities, Identities and Data: The findings of the DARIAH Community Engagement Working Group","1","https://eadh2018.exordo.com/programme/presentation/53",""
"8148","43","A First Attempt Towards General Purpose Data Model for Historical Databases","1","https://eadh2018.exordo.com/programme/presentations",""
"8149","43","""Linked Data"" and Knowledge Modelling in Literary Studies: An Ontology for the Representation of Knowledge on Intertextuality in Literature","1","https://eadh2018.exordo.com/files/papers/154/final_draft/abstract_english.pdf",""
"8150","43","KEYNOTE 2: Data in Virtual Reconstructions of Cultural Heritage","8","https://eadh2018eadh.files.wordpress.com/2018/12/eadh2018_programme_5dec1.pdf",""
"8151","43","Dealing with Large-Scale Archaeological Data. Spatial Analysis on the Christianisation of the Rural Countryside of Medieval Hungary","1","https://eadh2018.exordo.com/files/papers/97/final_draft/Abstract.pdf",""
"8152","43","Modelling multi-disciplinary knowledge for a research platform in early modern pharmacy and botany","1","https://eadh2018.exordo.com/programme/presentation/57",""
"8153","43","Ein frühneuzeitlicher Self-Tracker und sein Datenpool: Johann Christian Senckenbergs ""Observationes in me ipso factae""","1","https://eadh2018.exordo.com/programme/presentation/58",""
"8154","43","A FRBROO-based annotation ontology for digital editing","1","https://eadh2018.exordo.com/files/papers/93/final_draft/A_FRBROO-based_annotation_ontology_for_digital_editing__Final_.pdf",""
"8155","43","Porting the “Thirty-Six Dramatic Situations” to a Multilingual Ontology","1","https://eadh2018.exordo.com/files/papers/141/final_draft/Porting_the_36_situations_to_an_Ontology_final.pdf",""
"8156","43","Structuring Humanities’ Data through Formal Domain Ontologies: A Use Case from the Domain of Ancient Greek Dress","1","https://eadh2018.exordo.com/files/papers/172/final_draft/EADH__submission_for_long_paper.pdf",""
"8157","43","The unknown and the uncertain. A data discovery journey from an analogous data collection to an interactive exploration space","1","https://eadh2018.exordo.com/files/papers/159/final_draft/exploreAT__EADH_final.pdf",""
"8158","43","A Tale of Two Suburbs: A GIS Analysis of the 1911 Census for Rathmines and Pembroke","1","https://eadh2018.exordo.com/files/papers/119/final_draft/A_Tale_of_Two_SuburbsAbstract_DW.pdf",""
"8159","43","Leveraging on the power of expert content curation: the OpenMethods metablog","1","https://eadh2018.exordo.com/programme/presentation/64",""
"8160","43","Poetry and Digital Humanities making interoperability possible in a divided world of digital poetry: POSTDATA project","1","https://eadh2018.exordo.com/files/papers/32/final_draft/galway_2018_final.pdf",""
"8161","43","The Shape of Time and Storifying Data: Modeling Historical Processes and their Temporal Dimension in Knowledge Graphs","1","https://eadh2018.exordo.com/files/papers/45/final_draft/The_ShapeOfTime_StoryfyingData_AbstractShortPaper_Final_SV.pdf",""
"8162","43","The Project Gutenberg Ontology","1","https://eadh2018.exordo.com/files/papers/55/final_draft/project-gutenberg-ontology.pdf",""
"8163","43","Aggregation und Vernetzung projektübergreifender Metadaten: ein Erfahrungsbericht","1","https://eadh2018.exordo.com/programme/presentation/68",""
"8164","43","Creating and publishing manuscript metadata in TEI: problems and solutions","1","https://eadh2018eadh.files.wordpress.com/2018/12/eadh2018_programme_5dec1.pdf",""
"8165","43","Co-creation of a thesaurus at the interface of cultural lexicography & cultural infrastructures: the case-study topothek.at & exploreAT!","1","https://eadh2018.exordo.com/files/papers/145/final_draft/EADH2018-Topothek-final-submission.pdf",""
"8166","43","Cultural Interaction in Early Roman Spain through Linked Open Data","1","https://eadh2018.exordo.com/files/papers/101/final_draft/EADH_abstract_Final_3.pdf",""
"8167","43","Linked Ancient World Data: The User Experience","1","https://eadh2018.exordo.com/files/papers/127/final_draft/EADHProposal_Final.pdf",""
"8168","43","The Irish Rising of 1916: Computational Analysis of The Property Losses Committee, Insurance claims","1","https://eadh2018.exordo.com/programme/presentation/73",""
"8169","43","Modelling Scale in Historiographical Data","1","https://eadh2018.exordo.com/files/papers/168/final_draft/ModellingScaleInHistoriographicalData.pdf",""
"8170","43","Creating richly annotated linguistic corpora for languages with few linguistic resources","1","https://eadh2018.exordo.com/programme/presentation/78",""
"8171","43","Data Philosophy","1","https://eadh2018.exordo.com/programme/presentation/75",""
"8172","43","“Obscurum vocabulum” - Data as coded knowledge. Tackling the challenge of implicit knowledge in data modeling using the example of alchemical literature","1","https://eadh2018.exordo.com/files/papers/42/final_draft/EADH_Galway.pdf",""
"8173","43","Beyond data modelling","1","https://eadh2018.exordo.com/files/papers/84/final_draft/Abstract_Long_paper_Ciula__Eide__Marras__Sahle.pdf",""
"8174","43","Against “version”: typed variant relations as an alternative to this abused word","1","https://eadh2018.exordo.com/programme/presentation/79",""
"8175","43","Data science and the language question in digital humanities pedagogy: the example of Programming Historian","1","https://eadh2018.exordo.com/files/papers/99/final_draft/Data-science-language-question-PH.pdf",""
"8176","43","A research-oriented and case-based data federation for the Humanities","1","https://eadh2018.exordo.com/programme/presentation/81",""
"8177","43","Genre Classification in Novels: A Hard Task for Humans and Machines?","1","https://eadh2018.exordo.com/files/papers/46/final_draft/20181205_genre_classification_human_vs_machines.pdf",""
"8178","43","Can We Describe a Literary Character by Its Explicit Attributions Based on Syntactic Annotation?","1","https://eadh2018.exordo.com/files/papers/108/final_draft/Abstract_EADH.pdf",""
"8180","43","Who is the author? Modeling creative relations in television writing","1","https://eadh2018.exordo.com/programme/presentation/84",""
"8181","43","HistoGIS - A Geographical Information System, workbench and repository to retrieve, collect, create, enrich and preserve historical temporalized spatial data sets","1","https://eadh2018.exordo.com/programme/presentation/85",""
"8182","28","Epistemology","23","",""
"8183","28","Toward a rationale of electronic textual criticism","1","","8182"
"8184","28","Metaphora ex machina: how to use the creative potential of the humanities for the ""hard sciences""","1","","8182"
"8185","43","Possibilities and peculiarities of application of census data for identification and GIS-mapping of assimilation rates","1","https://eadh2018.exordo.com/files/papers/144/final_draft/polovyi_abstract_possibilities_of_census_data__.pdf",""
"8186","28","Against the quest for ""zero meaning,"" Theory and practice of a computer based analysis of ""action""-structures in literary texts","1","","8182"
"8187","43","Lab In Virtuo : A Intelligent Virtual Environment dedicated to History and Heritage of Industrial Landscapes","1","https://eadh2018.exordo.com/programme/presentation/87",""
"8188","28","Databases","23","",""
"8189","28","Conceptual modeling versus visual modeling: a technological key to building consensus","1","","8188"
"8190","28","Automatic recognition of textual structures of dictionaries","1","","8188"
"8191","43","Progressive Visual Decision Making for Digital Humanities (PROVIDEDH): Conceputal outline and crowd-sourcing sources of uncertainties","1","https://eadh2018.exordo.com/files/papers/165/final_draft/PROVIDEDH_EADH_final.pdf",""
"8192","28","Automatic representation of the semantic content of complex legal texts","1","","8188"
"8193","43","Exploring biographies: finding new group members based on significant terms","1","https://eadh2018.exordo.com/files/papers/125/final_draft/Exploring_biographies.pdf",""
"8194","28","Computational linguistics","23","",""
"8195","43","Wikipedia Mention Graphs by Example","1","https://eadh2018.exordo.com/files/papers/37/final_draft/MentionGraphsEADH.pdf",""
"8196","28","Des mots et des nombres","1","","8194"
"8197","43","Reader experience labeling automatized: Text similarity classification of user-generated book reviews","1","https://eadh2018.exordo.com/files/papers/76/final_draft/Goodreads_EADH2018_Final.pdf",""
